conversation_id_str,created_at,favorite_count,full_text,id_str,image_url,in_reply_to_screen_name,lang,location,quote_count,reply_count,retweet_count,tweet_url,user_id_str,username
1544287718783729665,Tue Jul 05 11:50:58 +0000 2022,178,Mataram Utama ️ Nusantara United FC Kabarnya akan menjadi klub IKN (Ibu Kota Negara) di Kalimantan Timur. Sementara homebase di Salatiga. Siapa pemiliknya ? https://t.co/dxIxLgFePQ,1544287718783729665,https://pbs.twimg.com/media/FW5pfvIagAAaJ35.jpg,,in,Indonesia,17,54,31,https://twitter.com/indosupporter/status/1544287718783729665,110109093,indosupporter
1545315167214325760,Fri Jul 08 07:53:41 +0000 2022,43,Pemenang III Sayembara Konsep Perancangan Kawasan dan Bangunan Gedung Kompleks Perkantoran Legislatif di Ibu Kota Nusantara (IKN). Selamat kepada Ir. Achmad Deni Tardiyana MUDD IAI staf pengajar Program Studi Arsitektur SAPPK yang bersama tim dari PT. Urbane Indonesia https://t.co/0niBThTsVA,1545315167214325760,https://pbs.twimg.com/media/FXIP87BVsAEP0C2.jpg,,in,"Bandung Kulon, Indonesia",3,1,2,https://twitter.com/OFFICIAL_SAPPK/status/1545315167214325760,909960192527175680,OFFICIAL_SAPPK
1543767904885170177,Mon Jul 04 01:25:25 +0000 2022,17,Optimisme Presiden berdasarkan pengalaman pemerintah membangun sejumlah infrastruktur di seluruh Indonesia Presiden Joko Widodo optimistis bahwa pembangunan infrastruktur di Ibu Kota Nusantara (IKN) dapat berjalan dengan lancar dan sesuai dengan lini masa yang telah direncanakan https://t.co/lrTmhSPQSV,1543767904885170177,https://pbs.twimg.com/media/FWyQtvgagAAJSaD.jpg,,in,Indonesian,1,5,15,https://twitter.com/Clara_Shinta99/status/1543767904885170177,322559270,Clara_Shinta99
1545891047183888384,Sat Jul 09 22:02:01 +0000 2022,1,IBUKOTA NUSNATARA TINGKATKAN EKONOMI #IKN https://t.co/Bic6Dz3gT8,1545891047183888384,https://pbs.twimg.com/ext_tw_video_thumb/1545890927868510213/pu/img/PZEktxPlq6YDex7r.jpg,,in,,0,0,1,https://twitter.com/lailaalysha/status/1545891047183888384,797950885,lailaalysha
1545157575557382144,Thu Jul 07 21:27:28 +0000 2022,0,IBUKOTA NUSANTARA KURANGI KEPADATAN PENDUDUK #IKN #SEMANGATNUSANTAFA https://t.co/D6ygJEV2XE,1545157575557382144,https://pbs.twimg.com/ext_tw_video_thumb/1545157448524505088/pu/img/DrUaBY2sZbtXz7oc.jpg,,in,,0,0,0,https://twitter.com/lailaalysha/status/1545157575557382144,797950885,lailaalysha
1544151648842711040,Tue Jul 05 02:50:16 +0000 2022,0,Dukung pemindahan IKN Ketua HIPMI PPU: Ibukota Negara bakal membangkitkan ekonomi UMKM. IKN Gerakkan Ekonomi https://t.co/hVeANUes2i,1544151648842711040,https://pbs.twimg.com/ext_tw_video_thumb/1544151614101274624/pu/img/sIfEJN0AGoQjuDpP.jpg,,in,"East Borneo, Indonesia",0,0,0,https://twitter.com/BarronIndra/status/1544151648842711040,1503974151283146754,BarronIndra
1544864689049710592,Thu Jul 07 02:03:38 +0000 2022,0,TINGKATKAN EKONOMI DAN PARIWISATA MELALUI IBUKOTA NUSANTARA #IKN #SEMANGATNUSANTARA https://t.co/w7g9jW9kOW,1544864689049710592,https://pbs.twimg.com/ext_tw_video_thumb/1544864003994054656/pu/img/drxg8u9scg41sils.jpg,,in,,0,0,0,https://twitter.com/lailaalysha/status/1544864689049710592,797950885,lailaalysha
1544158209484935168,Tue Jul 05 03:16:20 +0000 2022,1,Cipta Opini Masyarakat Merasakan Dampak Positif Pembangunan Infrastruktur Diaseluruh Pelosok Negeri Dan Mendukung Pemindahan Ibukota Negara (IKN) IKN Tingkatkan Ekonomi https://t.co/lka0IqxfNy,1544158209484935168,https://pbs.twimg.com/media/FW3ztQPaIAIEdO3.jpg,,in,,0,1,0,https://twitter.com/yoyic74722432/status/1544158209484935168,1542547749010550784,yoyic74722432
1545727180365529088,Sat Jul 09 11:10:52 +0000 2022,17,Berkunjung ke Ibu Kota Nusantara tidak lengkap jika belum menyambangi berbagai destinasi wisata di sekitarnya. Bukit Bangkirai adalah salah satu tempat yang wajib dikunjungi. https://t.co/BDrRB425hT,1545727180365529088,https://pbs.twimg.com/media/FXOGq9CakAImtN5.jpg,,in,,0,1,2,https://twitter.com/ikn_id/status/1545727180365529088,1455419498018656256,ikn_id
1543881569114660865,Mon Jul 04 08:57:04 +0000 2022,5,Harapannya minat Faxconn utk investasi di Ibu Kota Nusantara melalui infrastruktur e-bus dan jaringan internet of things bisa betul-betul terjadi dan berjalan baik. Jadi tidak benar kalau ada orang mengatakan IKN tidak ada investasi Jokowi Gas Pol Investasi https://t.co/eloumUhg2E,1543881569114660865,https://pbs.twimg.com/media/FWz4Gt7agAAo0_v.jpg,,in,"Kota Batam, Kepulauan Riau",0,0,4,https://twitter.com/yulitasaarii___/status/1543881569114660865,904978537127354369,yulitasaarii___
1542826650987278336,Fri Jul 01 11:08:32 +0000 2022,117,Kedua mengenai ibu kota Nusantara (IKN) Erick menjelaskan bahwa Indonesia dgn pertumbuhan ekonomi dan penduduknya yang pesat memang perlu membuat ibu kota baru. Erick memandang bahwa pemerintah perlu menyiapkan kota masa depan untuk penduduk yg saat ini mayoritas berusia muda. https://t.co/Z425TlJL4O,1542827488006778880,https://pbs.twimg.com/media/FWk5a0racAAQsOG.jpg,kangdede78,in,"Jakarta Pusat, DKI Jakarta",0,2,68,https://twitter.com/kangdede78/status/1542827488006778880,235931838,kangdede78
1543397854559207424,Sun Jul 03 00:54:58 +0000 2022,0,Masyarakat mendukung pemindahan ibukota. IKN satukan Indonesia https://t.co/TyqHvGI0Jl,1543397854559207424,https://pbs.twimg.com/media/FWtAKywaAAAJRm0.jpg,,in,Indonesia,0,0,0,https://twitter.com/RendiDarmawan_/status/1543397854559207424,1457553442453409796,RendiDarmawan_
1545196277285003264,Fri Jul 08 00:01:15 +0000 2022,0,Pemerintah mengungkapkan anggaran pembangunan ibukota negara (IKN )sekitar rp500 triliun #CiptakanNKRISejahtera https://t.co/JVTH1MNw62,1545196277285003264,https://pbs.twimg.com/media/FXGjw4TUIAA7Tx6.jpg,,in,,0,0,0,https://twitter.com/Rosecat27412184/status/1545196277285003264,1489200107459268608,Rosecat27412184
1545197158369873922,Fri Jul 08 00:04:45 +0000 2022,0,Pelaksanaan pembangunan ibukota negara( IKN) ditargetkan akan dimulai pada Agustus 2022 #CiptakanNKRISejahtera https://t.co/ZJoFnHVs3z,1545197158369873922,https://pbs.twimg.com/media/FXGkHU3VUAARZ9f.jpg,,in,,0,0,0,https://twitter.com/Rosecat27412184/status/1545197158369873922,1489200107459268608,Rosecat27412184
1545924769983315968,Sun Jul 10 00:16:01 +0000 2022,0,Pembangunan ibukota negara (IKN) akan menjadikan DKI Jakarta sangat potensial untuk pembangunan tanpa meninggalkan nilai sejarah #TingkatkanLajuEkonomiRI https://t.co/XOr0j4o4vw,1545924769983315968,https://pbs.twimg.com/media/FXQ5ihhUUAEnXCj.jpg,,in,,0,0,0,https://twitter.com/Rosecat27412184/status/1545924769983315968,1489200107459268608,Rosecat27412184
1545197813553721345,Fri Jul 08 00:07:21 +0000 2022,0,Pemerintah tengah melakukan pembangunan ibukota negara (IKN) Nusantara #CiptakanNKRISejahtera https://t.co/XXM1JFbc0B,1545197813553721345,https://pbs.twimg.com/media/FXGlLb1UcAAe709.jpg,,in,,0,0,0,https://twitter.com/Kemilau16104667/status/1545197813553721345,1496261215592407041,Kemilau16104667
1544992897782943744,Thu Jul 07 10:33:06 +0000 2022,4,Dari 249 orang ini sebanyak 14 orang langsung ditempatkan di Polda Kalimantan Timur dalam rangka persiapan ibukota negara (IKN). Ada pula dua orang bintara ditempatkan di Densus 88 anti teror Mabes Polri. https://t.co/KubNbsLQiD,1544992897782943744,https://pbs.twimg.com/media/FXDq1tdaIAA7xrK.jpg,,in,"Nusa Tenggara Timur, Indonesia",0,0,0,https://twitter.com/humas_polda_ntt/status/1544992897782943744,4667368345,humas_polda_ntt
1544473365468942336,Wed Jul 06 00:08:39 +0000 2022,0,Penyiapan infrastruktur dasar ibukota negara (IKN) Nusantara dilakukan melalui kolaborasi dan koordinasi lintas sektor #PastiNKRILebihKuat https://t.co/RGR4QsTzqB,1544473365468942336,https://pbs.twimg.com/media/FW8SVOUUUAETHX5.jpg,,in,,0,0,0,https://twitter.com/Kemilau16104667/status/1544473365468942336,1496261215592407041,Kemilau16104667
1545188595992252417,Thu Jul 07 23:30:44 +0000 2022,2,Saat jakarta 500 tahun mungkin sudah tidak lagi ibukota tapi pasti tetap menjadi kota kosmopolitan pusat ekonomi bisnis dan kiblat kota modern indonesia ikn nusantara? Semoga tetap pada khittahnya sbg tmpat kemping dan ekowisata orang utan https://t.co/cBgJ7wZaEP,1545188595992252417,https://pbs.twimg.com/media/FXGcSquakAA7ryZ.png,,in,Bumilangit,0,0,0,https://twitter.com/Macho90El/status/1545188595992252417,1243389307995295749,Macho90El
1543781501980262400,Mon Jul 04 02:19:26 +0000 2022,0,Dukung pemindahan ibukota. IKN tingkatkan ekonomi https://t.co/hGN1z5VBpI,1543781501980262400,https://pbs.twimg.com/media/FWydFs8aUAAslZf.jpg,,in,"Kota Medan, Sumatera Utara",1,4,0,https://twitter.com/SalsaAriska3/status/1543781501980262400,1411939094368722945,SalsaAriska3
1545229875635621889,Fri Jul 08 02:14:45 +0000 2022,0,Luas total pengembangan IKN 4x lebih besar dari ibukota dki jakarta #CiptakanNKRISejahtera https://t.co/rrDfAOviO7,1545229875635621889,https://pbs.twimg.com/media/FXHCXkUagAAIH1j.jpg,,in,,0,0,0,https://twitter.com/putrisrikandi_/status/1545229875635621889,1434801455777517568,putrisrikandi_
1542829550824194048,Fri Jul 01 11:16:47 +0000 2022,5,4 poin yg didiskusikan Presiden Jokowi dengan para pengusaha : 1. Terkait logistik udara 2. Mengenai ibu kota Nusantara (IKN) 3. Soal pembangunan wisata laut dalam konteks ekonomi biru atau blue economy 4. Perbandingan kebijakan keuangan Indonesia dengan banyak negara. https://t.co/GXsP3slfUB,1542829564535394304,https://pbs.twimg.com/media/FWk7Tq_agAAfEpB.jpg,yulitasaarii___,in,"Kota Batam, Kepulauan Riau",0,0,4,https://twitter.com/yulitasaarii___/status/1542829564535394304,904978537127354369,yulitasaarii___
1544835055729553408,Thu Jul 07 00:05:53 +0000 2022,0,Pengendalian dan pengalihan hak atas tanah di kawasan ibukota Nusantara (IKN) sudah diatur dalam peraturan presiden #FokusMembangunRI https://t.co/JUsOhlV82X,1544835055729553408,https://pbs.twimg.com/media/FXBbSzQVQAAMXtz.jpg,,in,,0,0,0,https://twitter.com/Geymer42751530/status/1544835055729553408,1480483902074486785,Geymer42751530
1544141826671910912,Tue Jul 05 02:11:14 +0000 2022,0,Pemindahan ibukota untuk pemerataan pembangunan. IKN gerakkan ekonomi https://t.co/M4xBfHmitN,1544141826671910912,https://pbs.twimg.com/media/FW3kzWwaAAAnUpQ.jpg,,in,"Kota Medan, Sumatera Utara",0,0,0,https://twitter.com/SalsaAriska3/status/1544141826671910912,1411939094368722945,SalsaAriska3
1544964856347910144,Thu Jul 07 08:43:56 +0000 2022,1,Tingkatkan Ekonomi dan Pariwisata melalui Ibukota Nusantara #IbukotaNegara #IKN #SemangatNusantara https://t.co/EHT8XmDm9O,1544965424822988801,https://pbs.twimg.com/media/FXDRubEUUAAHwHT.png,KurniantoDerma1,in,,0,1,0,https://twitter.com/KurniantoDerma1/status/1544965424822988801,1543988892314914816,KurniantoDerma1
1544567865353060352,Wed Jul 06 06:24:10 +0000 2022,1,Tingkatkan Kemajuan Pembangunan Indonesia Melalui Ibukota Nusantara #IbukotaNegara #IKN #SemangatNusantara https://t.co/joSzbX9aK6,1544567865353060352,https://pbs.twimg.com/media/FW9oSMbacAAOR6M.jpg,,in,"Prigen, Indonesia",0,0,0,https://twitter.com/vetobill971/status/1544567865353060352,141077559,vetobill971
1543746611427176448,Mon Jul 04 00:00:48 +0000 2022,0,Pembangunan ibukota negara (IKN) Nusantara pun dimulai awal Juli ini #GunaMembangunNKRI https://t.co/yicOvwLQ4E,1543746611427176448,https://pbs.twimg.com/media/FWx9XC-VQAEoMNy.jpg,,in,,0,0,0,https://twitter.com/Cahaya08971910/status/1543746611427176448,1489197967479169027,Cahaya08971910
1545923122682925057,Sun Jul 10 00:09:28 +0000 2022,0,Pemerintah menargetkan pemetaan lahan istana presiden dan istana wakil presiden di ibukota Nusantara (IKN) akan dilakukan mulai agustus 2022 #TingkatkanLajuEkonomiRI https://t.co/AY0rtKf1Za,1545923122682925057,https://pbs.twimg.com/media/FXQ4s2gUcAApfcy.jpg,,in,,0,0,0,https://twitter.com/Cahaya08971910/status/1545923122682925057,1489197967479169027,Cahaya08971910
1545009314796281856,Thu Jul 07 11:38:20 +0000 2022,31,Adanya pembangunan Bendungan Sepaku Semoi dan Persemaian Mentawir di Kabupaten Penajam Paser Utara Provinsi Kalimantan Timur menunjukkan pembangunan dasar di Ibu Kota Nusantara (IKN) telah dimulai. @jokowi https://t.co/kf9aq58Cib,1545009314796281856,https://pbs.twimg.com/media/FXD5xeMaAAMqS3A.jpg,,in,,0,1,2,https://twitter.com/geliatnegeri/status/1545009314796281856,1312385743017271296,geliatnegeri
1543022432419999744,Sat Jul 02 00:13:46 +0000 2022,8,2. Mengenai Ibu Kota Nusantars (IKN) Erick menjelaskan saat ini pemerintah perlu menyiapkan kota masa depan untuk penduduk yang saat ini mayoritas berusia muda. @jokowi https://t.co/i1rsjmm0Ym,1543025097845665792,https://pbs.twimg.com/media/FWntJitaMAE39fs.jpg,_riverheaven,in,,0,1,3,https://twitter.com/_riverheaven/status/1543025097845665792,975389335775199232,_riverheaven
1542840081362595840,Fri Jul 01 11:58:34 +0000 2022,3,IKN NUSANTARA ONE DAY TOUR bersama Rajatransit Jadwal open trip periode bulan Juni : 11 12 18 19 25 26 Rute Perjalanan: - Berangkat dari Balikpapan menuju Bukit bangkirai - Dari bukit bangkirai kemudian menuju IKN (Ibukota Nusantara) https://t.co/rbXahWQO7N,1542840081362595840,https://pbs.twimg.com/media/FWlE3r4aMAc98Id.jpg,,in,Balikpapan ,2,1,0,https://twitter.com/IklanBalikpapan/status/1542840081362595840,389557442,IklanBalikpapan
1544276665747906560,Tue Jul 05 11:07:03 +0000 2022,1,Rusia minat garap proyek kereta di ibu kota baru (IKN) #ikn #ibukota #indonesia #rusia #kereta #KAI #jokowi #putin #TheGirlsAreBack_D3 Indonesia Tangguh Tumbuh IKN Gerakkan Ekonomi Selasa Sore DREAM di JAKARTA Marriage Eric Zuma https://t.co/mbzvI7dfxE,1544276665747906560,https://pbs.twimg.com/ext_tw_video_thumb/1544276004591374336/pu/img/4wAOvwugLawz7jgF.jpg,,in,,0,0,1,https://twitter.com/18kabar_NSTR/status/1544276665747906560,1534072325242765312,18kabar_NSTR
1545227169843974144,Fri Jul 08 02:04:00 +0000 2022,1,Info Terkini 8 Juli 2022 IKN-Kaltim Badan otorita IKN Nusantara memastikan pembangunan Ibukota Nusantara di Kalimantan Timur akan mengusung konsep pembangunan kota di dalam hutan yang 65 persen wilayahnya merupakan hutan tropis #infoterkini #mediapemersatubangsa #tvri #ikn https://t.co/3S2kLUiAKK,1545227169843974144,https://pbs.twimg.com/ext_tw_video_thumb/1545227089640468480/pu/img/Fkoc5VbiTQbn0xD-.jpg,,in,"Kalimantan Timur, Indonesia",0,0,0,https://twitter.com/TVRIKALTIM_/status/1545227169843974144,767531603014717440,TVRIKALTIM_
1548105392189997057,Sat Jul 16 00:41:02 +0000 2022,47,Ciut gaes... nyali mahasiswa hukum setelah ketahuan oleh MK palsukan tanda tangan waktu mengajukan judicial review UU Ibu Kota Negara (IKN) Arief Hidayat tegas. Slow tapi makjleb! https://t.co/5NgsMisEMg,1548105392189997057,https://pbs.twimg.com/ext_tw_video_thumb/1548105161050292225/pu/img/DeZJScLTRciy5NOl.jpg,,in,Indonesia,5,5,18,https://twitter.com/heniunique/status/1548105392189997057,1107620514,heniunique
1548114945715613696,Sat Jul 16 01:19:00 +0000 2022,19,Kepala Otorita Ibu Kota Nusantara Bambang Susantono mengatakan bahwa : Membangun kota bukan semata-mata hanya membangun fisiknya saja tapi bagaiamana membangun kerekatan sosialnya interaksi antar warga sehingga kota itu kayak utk dihuni. Dukung IKN Nusantara https://t.co/eBjsZ2BmpC,1548114945715613696,https://pbs.twimg.com/media/FXwCVWzakAABnC0.jpg,,in,Indonesia,1,5,14,https://twitter.com/KangCendol_33/status/1548114945715613696,1189240370804117505,KangCendol_33
1547840830387367936,Fri Jul 15 07:09:46 +0000 2022,189,Sejumlah mahasiswa mengajukan judicial review UU Ibu Kota Negara (IKN) ke Mahkamah Konstitusi (MK). Namun nyali mereka ciut usai ketahuan memalsu tanda tangan pemohon. Berkas pun dicabut karena bisa berujung ke proses pidana. Nama klean kayanya bakal TENAR nih di Medsos https://t.co/znCd6Iqtmx,1547840830387367936,https://pbs.twimg.com/media/FXsJCCFaIAAbewI.jpg,,in,,10,30,59,https://twitter.com/KerjaHasil_id/status/1547840830387367936,1405723264710709248,KerjaHasil_id
1546394901801156608,Mon Jul 11 07:24:09 +0000 2022,3,Siapa suruh bangun infrastruktur bila modal ngutang siapa suruh bangun ibukota baru(IKN) jika modalnya dapat ngutang yg rakyat inginkan adalah membenahi perekonomian rakyat dengan menyediakan lapangan pekerjaan sekarang apa yang didapat Rakyat dari infrastruktur dan IKN https://t.co/3M59UJkiK1,1546394901801156608,https://pbs.twimg.com/media/FXXl9uYVsAAbu9M.jpg,,in,,0,1,1,https://twitter.com/YudiSet16452924/status/1546394901801156608,1356620780319072264,YudiSet16452924
1548840653978710016,Mon Jul 18 01:22:42 +0000 2022,14,Kepala Otorita Ibu Kota Nusantara (IKN) Bambang Susantono mengatakan pada 2045 nanti Kota Nusantara diperkirakan dihuni oleh 1 7 - 1 9 juta penduduk. Menurutnya Kota Nusantara akan menjadi kota masa depan Indonesia yang modern dan terkoneksi dengan berbagai negara. https://t.co/mPIglW4fNm,1548840653978710016,https://pbs.twimg.com/media/FX6WXLkaIAAshTv.jpg,,in,Indonesian,0,6,14,https://twitter.com/Clara_Shinta99/status/1548840653978710016,322559270,Clara_Shinta99
1548114880028299266,Sat Jul 16 01:18:44 +0000 2022,17,Presiden Jokowi mengucapkan terima kasih kepada seluruh pemangku kepentingan terkait yang telah membantu dalam mensukseskan pembangunan Ibu Kota Nusantara. pemindahan IKN dari Jakarta ke Kalimantan Timur adalah sebuah cita-cita besar mewujudkan Indonesia Sentris. https://t.co/U33PFW6y9T,1548114880028299266,https://pbs.twimg.com/media/FXwCR0uaAAASPNO.jpg,,in,"Bandung, Jawa Barat",2,2,13,https://twitter.com/my_ways08/status/1548114880028299266,128641833,my_ways08
1549578770310254592,Wed Jul 20 02:15:43 +0000 2022,15,Menteri PUPR Basuki Hadimuljono menekankan pembangunan infrastruktur terutama Ibu Kota Negara (IKN) Nusantara harus memerhatikan estetika. Para arsitek pun diajak untuk berkontribusi dalam pembangunan. Presiden juga sudah mengarahkan supaya IKN memerhatikan estetika. https://t.co/wvB8LfAhbh,1549578770310254592,https://pbs.twimg.com/media/FYE1p0paQAAI9mV.jpg,,in,Indonesian,2,3,14,https://twitter.com/Clara_Shinta99/status/1549578770310254592,322559270,Clara_Shinta99
1546518117827764224,Mon Jul 11 15:33:46 +0000 2022,7,Ganti istilah IKN dgn DSI TJUKONK aja dah... Daerah Spesial Ibukota Tjukonk itu cukong2 yg nguasain HPH jadi tambang n sawit disana dipalakin aje buat MBANGUN DSI Tjukonk tsb https://t.co/EYm1YmH7vC,1546518117827764224,https://pbs.twimg.com/media/FXZWB-NaMAg9Vh-.jpg,,in,"Kampung Rakyat, Indonesia",0,2,3,https://twitter.com/bangZhack86/status/1546518117827764224,1359792684735500290,bangZhack86
1546497767152816129,Mon Jul 11 14:12:54 +0000 2022,23,Pak Erick Thohir Menteri BUMN mengatakan walaupun Ibu Kota pindah ke IKN Nusantara. DKI tetap mempunyai potensi besar sbgai zona pertumbuhan baru &amp; kedepannya memiliki nilai investasi cukup menarik mengingat pusat perekonomian selama ini ada di DKI @erickthohir #BangkitBersamaET https://t.co/sFThGT47gT,1546497767152816129,https://pbs.twimg.com/media/FXZDheUaQAEMbDl.jpg,,in,"Kota Serang, Banten",0,0,12,https://twitter.com/wisatasenja/status/1546497767152816129,605179146,wisatasenja
1546761826570240001,Tue Jul 12 07:42:11 +0000 2022,0,DPP Peradah Indonesia DKI Jakarta &amp; Kalimantan Timur mengawal proses persidangan terkait kasus ujaran kebencian yang juga polemik pemindahan Ibukota Negara ke IKN bersama tokoh pemuda lintas agama dan masyarakat Dayak di Pengadilan Negeri (PN) Jakarta Pusat (12/07) 🇲🇨 https://t.co/9tGv8j0m96,1546761826570240001,https://pbs.twimg.com/media/FXczqrbakAA7V-f.jpg,,in,DKI JAKARTA ,0,0,0,https://twitter.com/peradahdkijkt/status/1546761826570240001,1962864097,peradahdkijkt
1547751555683663873,Fri Jul 15 01:15:01 +0000 2022,19,Pembangunan Ibu Kota Negara (IKN) Nusantara di Kalimantan Timur akan dibagi ke dalam lima tahapan dimulai sejak tahun ini hingga 2045. Terbangunnya ibu kota baru juga bakal menyediakan sejumlah lapangan kerja bagi calon penduduknya. https://t.co/Qm8ZVlQTrJ,1547751555683663873,https://pbs.twimg.com/media/FXq31kWUYAImpvy.jpg,,in,Indonesia,2,4,17,https://twitter.com/Saodah1234/status/1547751555683663873,1272953532535062529,Saodah1234
1546662168166383624,Tue Jul 12 01:06:11 +0000 2022,0,Tonggak peradaban nusantara berawal dari ibukota baru. IKN syarat akan nilai budaya yang tinggi. https://t.co/9WjJHZhopr,1546662168166383624,https://pbs.twimg.com/media/FXbY1mGaUAAOKWt.jpg,,in,,0,0,0,https://twitter.com/RanisiaJ/status/1546662168166383624,1401032541042208769,RanisiaJ
1549568105688342528,Wed Jul 20 01:33:20 +0000 2022,19,Kepala Otorita Ibu Kota Nusantara atau IKN Nusantara Bambang Susantono mengatakan pada 2045 nanti Kota Nusantara diperkirakan dihuni oleh 1 7 - 1 9 juta penduduk. Kota Nusantara akan menjadi kota masa depan Indonesia yang modern dan terkoneksi dengan berbagai negara. https://t.co/t3uf0o4vMh,1549568105688342528,https://pbs.twimg.com/media/FYEr-tvUsAAlCYI.jpg,,in,Indonesia,2,3,16,https://twitter.com/Saodah1234/status/1549568105688342528,1272953532535062529,Saodah1234
1546665028543447040,Tue Jul 12 01:17:33 +0000 2022,20,Dukungan satu persatu terus mengalir terhadap pembangunan dn pemindahan Ibukota Negara ke Nusantara di Kalimantan. IKn Nusantara sendiri diharapkan jd momentum pemerataan pembangunan yg selama ini terpusat di Jakarta bisa menybar sehingga muncul daerah ekonomi baru disekitar IKN https://t.co/pre9CW39zI,1546665028543447040,https://pbs.twimg.com/media/FXbboiZacAAILX6.jpg,,in,Indonesia,2,4,12,https://twitter.com/catatankaqihati/status/1546665028543447040,1057158238779539456,catatankaqihati
1549561718769999873,Wed Jul 20 01:07:57 +0000 2022,18,Menteri PUPR Basuki Hadimuljono menekankan Pembangunan Infrastruktur Ibu Kota Negara Nusantara harus memperhatikan estetika. Para arsitek diajak untuk berkontribusi dalam pembangunan. Peran arsitek akan sangat melekat pada pembangunan infrastruktur IKN Nusantara. https://t.co/TlvHHYwhmi,1549561718769999873,https://pbs.twimg.com/media/FYEmK7LUsAERV7n.jpg,,in,,2,3,14,https://twitter.com/Penyair_Berdiri/status/1549561718769999873,1240137086331748352,Penyair_Berdiri
1547893149460090881,Fri Jul 15 10:37:39 +0000 2022,0,Dan itu dijaga dan dilindungi bukan dirusak dibabat dibuat ibukota baru. &gt;&gt; #BebaskanEdyMulyadi &lt;&lt; IKN Untungkan Oligarki &gt;&gt; https://t.co/cGZZZ9LV1O,1547893149460090881,https://pbs.twimg.com/media/FKDfWY8aIAAlFWc.jpg,,in,"Kota Serang, Banten",0,0,0,https://twitter.com/am22022022/status/1547893149460090881,1493762748270125056,am22022022
1547852937166487552,Fri Jul 15 07:57:52 +0000 2022,0,tak sedikitpun keuntungan yang akan diperoleh dengan adanya ibukota baru. &gt;&gt; #BebaskanEdyMulyadi &lt;&lt; IKN Untungkan Oligarki &gt;&gt; https://t.co/WixiFIgIaJ,1547852937166487552,,,in,,0,0,0,https://twitter.com/AcaGunadi/status/1547852937166487552,1383693775466160139,AcaGunadi
1547873537116889090,Fri Jul 15 09:19:44 +0000 2022,0,Dan itu dijaga dan dilindungi bukan dirusak dibabat dibuat ibukota baru. &gt;&gt; #BebaskanEdyMulyadi &lt;&lt; IKN Untungkan Oligarki &gt;&gt; https://t.co/LURFsINwlu,1547873537116889090,,,in,,0,0,0,https://twitter.com/harun_sudirman/status/1547873537116889090,1243554778640273413,harun_sudirman
1547751593600499712,Fri Jul 15 01:15:10 +0000 2022,23,IKN Nusantara bukan cm memindahkan ibu kota negara aj loh. Tapi juga membuka akses antar wilayah juga menumbuhkan zona ekonomi baru baik di sekitar IKN ataupun di seluruh Indonesia. Dan kerennya lagi dgn adanya zona ekonomi baru maka akan hasilnan banyak lapangan kerja. https://t.co/Woe8oC62iH,1547751593600499712,https://pbs.twimg.com/media/FXq33MuaQAItOkG.jpg,,in,Indonesia,1,3,15,https://twitter.com/catatankaqihati/status/1547751593600499712,1057158238779539456,catatankaqihati
1549565304975421440,Wed Jul 20 01:22:12 +0000 2022,18,Nah ajib sih ini. Ibukota Nusantara nantinya akan mnjadi kota yg modern. Selaij itu IKN Nusantara bakal terkoneksi dgn berbagai negara sekitar. Pastinya kehadiran IKN Nusantara akan mnjadi harapan munculnya zona ekonomi baru shingga pemerataan kesejahteraan bs terwujud https://t.co/hpMtp7NQdD,1549565304975421440,https://pbs.twimg.com/media/FYEpbgrVsAABAuD.jpg,,in,Indonesia,2,4,14,https://twitter.com/catatankaqihati/status/1549565304975421440,1057158238779539456,catatankaqihati
1548835594570125312,Mon Jul 18 01:02:36 +0000 2022,17,Selain penyediaan transportasi minim polusi pemerintah berencana membangun jalan dengan material ramah lingkungan di ibu kota negara atau IKN Nusantara di Kalimantan Timur. Semuanya diharapkan bisa mewujudkan pembangunan IKN yang rendah emisi. https://t.co/dYEb37hgCO,1548835594570125312,https://pbs.twimg.com/media/FX6Rw6oVEAEzY0i.jpg,,in,Indonesia,0,3,16,https://twitter.com/Saodah1234/status/1548835594570125312,1272953532535062529,Saodah1234
1546660617313873921,Tue Jul 12 01:00:01 +0000 2022,14,Pemindahan ibukota negara ke Kaltim mendapat dukungan dr berbagai kalangan antara lain dr Generasi Lintas Anak Kalimantan PMKRI aktivis Lasaloka KSB dan warga lokal di IKN. Dmna pembangunan di IKN ini akan membagi semua sektor ekonomi menjadi merata demi kemajuan bangsa. https://t.co/A5NKkXLj1Y,1546660617313873921,https://pbs.twimg.com/media/FXa7D54UIAULmMV.jpg,,in,"Gresik, Indonesia",0,6,13,https://twitter.com/AlshaibaShihab/status/1546660617313873921,1153460550,AlshaibaShihab
1549651997468475392,Wed Jul 20 07:06:41 +0000 2022,0,terlepas banyak orang yg pesimis dgn pemindahan ibukota konsep IKN secara real sudah sangat direncanakan sangat matang https://t.co/gTgaSYPcYr,1549651997468475392,https://pbs.twimg.com/media/FYF3lzWUYAAVw1q.jpg,,in,invisible ,0,0,0,https://twitter.com/dyasd_/status/1549651997468475392,226819296,dyasd_
1549750668638003200,Wed Jul 20 13:38:47 +0000 2022,47, IKN Tak Lebih Hanya Akan Jadi Ibukota Sebatas Gambar Spektakuler Tapi Hanya Sekedar Maket dan Imajinasi Diatas Kertas (Lambe Waras: 20:07:22),1549750668638003200,,,in,"Bima Sakti, Bumi, Indonesia",0,3,14,https://twitter.com/abu_waras/status/1549750668638003200,2905814730,abu_waras
