"conversation_id_str","created_at","favorite_count","full_text","id_str","image_url","in_reply_to_screen_name","lang","location","quote_count","reply_count","retweet_count","tweet_url","user_id_str","username"
"1191942717766549506","Wed Nov 06 04:57:43 +0000 2019","13","Apakah #SahabatPembangunan berminat pindah ke Ibu Kota Negara (IKN) baru yang nantinya akan dibangun di Kalimantan Timur ? #bersamaindonesiamaju #SiapPindahIbuKota #Bappenas #Pembangunan https://t.co/ARrVUpGgxm","1191942717766549506","https://pbs.twimg.com/ext_tw_video_thumb/1191942442976759808/pu/img/jcV6QzgC4Xp_tlIP.jpg","","in","Jakarta","2","0","7","https://twitter.com/BappenasRI/status/1191942717766549506","235021856","BappenasRI"
"1191966320289550336","Wed Nov 06 06:31:31 +0000 2019","14","#SahabatPembangunan Kelestarian lingkungan adalah acuan dalam pembangunan Ibu Kota Negara (IKN) di Kalimantan Timur. Oleh karena itu ibu kota Indonesia nantinya akan dibangun dengan konsep Forest City. https://t.co/TvaaEPHf8y","1191966320289550336","https://pbs.twimg.com/media/EIq3CycW4Acskfw.jpg","","in","Jakarta","1","1","13","https://twitter.com/BappenasRI/status/1191966320289550336","235021856","BappenasRI"
"1190984673658146816","Sun Nov 03 13:30:48 +0000 2019","12","#SahabatPembangunan apa persepsimu tentang pemindahan Ibu Kota Negara (IKN) ke sebagian Kabupaten Penajam Paser Utara dan Kabupaten Kutai Kartanegara? Ikut surveinya ya! Klik https://t.co/FVi11483MU 🇲🇨🇲🇨🇲🇨 #IbuKotaBaru https://t.co/dj0E2MBJi7","1190984673658146816","https://pbs.twimg.com/media/EIc6PaCXsAAKVy-.jpg","","in","Jakarta","0","1","10","https://twitter.com/BappenasRI/status/1190984673658146816","235021856","BappenasRI"
"1191322399666364416","Mon Nov 04 11:52:48 +0000 2019","11","#SahabatPembangunan pasti setuju hutan adalah simpanan kekayaan yang harus kita jaga bersama. Oleh karena itu dalam membangun Ibu Kota Negara (IKN) baru di wilayah Kalimantan Timur semangat yang sama akan dijaga. via @BappenasRI #elshintaedisisore https://t.co/r1hnmMxa1N","1191322399666364416","https://pbs.twimg.com/ext_tw_video_thumb/1191322309484675073/pu/img/y-lBG0O2tgD8WrFM.jpg","","in","","0","2","1","https://twitter.com/RadioElshinta/status/1191322399666364416","121640063","RadioElshinta"
"1191247256671805440","Mon Nov 04 06:54:12 +0000 2019","0","Halooo Warga OGI! Gimana hari Senin kalian? OGI mau share Survei Persepsi masyarakat tentang Ibu Kota Negara (IKN) baru. Kami butuh suara kalian semua! Survei bisa diakses di link ini: https://t.co/eeSSqPpogm Penasaran kan?Buruan isi! @BappenasRI #IbuKotaBaru #inklusifterbuka https://t.co/oyWoYXrxHo","1191247256671805440","https://pbs.twimg.com/media/EIgpDclUcAA5f8C.png","","in","Indonesia","1","0","2","https://twitter.com/OpenGovIndo/status/1191247256671805440","348853018","OpenGovIndo"
"1192436199413043201","Thu Nov 07 13:38:38 +0000 2019","8","#SahabatPembangunan di Ibu Kota Negara (IKN) baru para penghuninya juga harus mebawa karakter serta budaya baru. Hal itu dikatakan oleh Presiden @Jokowi dalam sambutannya di acara pembukaan Indonesia Instructure Week 2019 dan Indonesia Infrastructure Development Financing (IIDF) https://t.co/FSnrGbNEnB","1192436199413043201","https://pbs.twimg.com/media/EIxiZSBUcAAp-4R.jpg","","in","Jakarta","0","1","1","https://twitter.com/BappenasRI/status/1192436199413043201","235021856","BappenasRI"
"1191566101282471937","Tue Nov 05 04:01:11 +0000 2019","0"," DH merupakan buronan kasus penambangan batu bara illegal di ring 1 wilayah Ibu Kota Negara (IKN) yang berperan sebagai pemodal. https://t.co/Y3KUn5i4Hs https://t.co/W0h4cHJGKL","1191566101282471937","https://pbs.twimg.com/media/EIlLDbwWkAAIoPr.jpg","","in","Bontang, Kaltim, Indonesia","0","0","0","https://twitter.com/bontang_post/status/1191566101282471937","3101199283","bontang_post"
"1190059747392675842","Fri Nov 01 00:15:28 +0000 2019","0","RUU IKN TERUS DIKEBUT KPFM BALIKPAPAN - Naskah akademis untuk Rancangan Undang-Undang (RUU) terkait pemindahan Ibu Kota Negara (IKN) ke wilayah Provinsi Kalimantan Timur (Kaltim) terus dikebut oleh Pemerintah... https://t.co/LATu0a4OSv","1190059747392675842","","","in","Balikpapan, Kalimantan Timur","0","0","0","https://twitter.com/BimaSaputra2017/status/1190059747392675842","873015522312413184","BimaSaputra2017"
"1192732185473769477","Fri Nov 08 09:14:47 +0000 2019","0","Kebijakan Ibu Kota Negara sudah di tetapkan. Kalimantan terpilih menjadi IKN terus warga Kalimantan sendiri apa yang di siapkan kiranya? Kiranya sebelum bersiap kita makan dulu lah biar tidak manggah besiap2 lawan https://t.co/dixj3P7CFz","1192732185473769477","","","in","Indonesia","0","0","0","https://twitter.com/FikriHadin/status/1192732185473769477","918427857424064512","FikriHadin"
"1190845383120830464","Sun Nov 03 04:17:18 +0000 2019","0","Mohon bantuannya mengisi survei persepsi masy ttg pemindahan Ibu Kota Negara (IKN): https://t.co/CkKo4wYEt8 Kementerian PPN/Bappenas saat ini... https://t.co/CkKo4wYEt8","1190845383120830464","","","in","Jakarta","0","0","0","https://twitter.com/rfmeirawan/status/1190845383120830464","1931338482","rfmeirawan"
"1190624763980288000","Sat Nov 02 13:40:39 +0000 2019","0","Mohon bantuannya mengisi survei persepsi masy ttg pemindahan Ibu Kota Negara (IKN): https://t.co/qix0zPSduk Bappenas saat ini tengah melakukan Studi Kelayakan Teknis Pemindahan IKN. Dalam studi ini diperlukan Survei Persepsi berbagai kelompok masyarakat. @BappenasRI","1190624763980288000","","","in","6º LU – 11º LS , 95º BT - 141º","0","0","0","https://twitter.com/justin_dra22/status/1190624763980288000","83080276","justin_dra22"
"1190515548615917569","Sat Nov 02 06:26:40 +0000 2019","8","Apakah krn karam saja shg perlu bêdol ibukota? Calon IKN Ind sdh dicanangkan di Kaltim dayadukung-dampak lingkungan dll sdg dlm kajian detil. any views? https://t.co/taYBn2RdVz","1190515548615917569","","","in","Sleman, Indonesia","0","1","0","https://twitter.com/widjokongko/status/1190515548615917569","79800284","widjokongko"
"1192091776896471040","Wed Nov 06 14:50:02 +0000 2019","4","Pembangunan Infrastruktur dan rencana strategis nasional pemindahan IKN ini berstandar Internasional (smart metropolis). https://t.co/MJq3Mnb6hp","1192091776896471040","","","in","Jakarta","0","4","0","https://twitter.com/kompascom/status/1192091776896471040","23343960","kompascom"
"1192026265923940352","Wed Nov 06 10:29:43 +0000 2019","5","Tol dibangun di ibu kota baru 57 Km dan jalur kereta 72 Km. Khusus untuk tol disambungkan dgn Tol Balikpapan-Samarinda yang melintasi calon lokasi IKN. Tol ini hampir rampung. https://t.co/MvewjoyGDU @RosaErna @DjanChoek @jonahmunda @FachryAditya9 @Dumax","1192026265923940352","","","in","Jakarta Capital Region, Indone","0","0","1","https://twitter.com/cagubnyinyir2/status/1192026265923940352","1013331201396912128","cagubnyinyir2"
"1190103437548982272","Fri Nov 01 03:09:05 +0000 2019","0","Kabinet baru digenjot untuk fokus IKN https://t.co/n1D7q9dLFw","1190103437548982272","","","in","","0","0","0","https://twitter.com/IDNTimes/status/1190103437548982272","388190238","IDNTimes"
"1192080203016790016","Wed Nov 06 14:04:02 +0000 2019","0","Rencana pemindahan Ibu Kota Negara ( IKN) ke Kalimantan Timur yakni di Kabupaten Paser Utara dan sebagian Kutai Kertanegara diyakini bakal memberikan dampak yang besar bagi sejumlah daerah di sekitarnya. https://t.co/ukmeyhzPOj","1192080203016790016","","","in","samarinda","0","0","0","https://twitter.com/Kaltim_ANTARA/status/1192080203016790016","560055446","Kaltim_ANTARA"
"1192330701376389120","Fri Nov 08 08:31:13 +0000 2019","0","@anggitaarimurti @jokowi UU Ibu Kota Negara (IKN) nya masih di godok git jd belom tau pasti jg bakal pindah ato enggaknyaa Haha boleeeh tp pake harga eceran yaa gaesss ","1192721222909349889","","anggitaarimurti","in","Jakarta, Indonesia","0","1","0","https://twitter.com/bang_mikeee/status/1192721222909349889","38404104","bang_mikeee"
"1192042429077024768","Wed Nov 06 11:33:56 +0000 2019","0","#kom11 Satori @Fraksi_NasDem #jabar8 : Pertahanan dan keamanan jika ibu kota pindah brrti kita hrs membangun pangkalan militer sekitar Kaltim padahal Jakarta ini sudah didesain pangkalan militernya supaya kuat jika terjadi perang. Di IKN ada tanah konglomerat apakah mudah... (1)","1192042429077024768","","","in","","0","0","0","https://twitter.com/WikiDPR2/status/1192042429077024768","3550853180","WikiDPR2"
"1190689049607995393","Sat Nov 02 17:56:06 +0000 2019","0","td siang ngebahas perpindahan Ibu Kota Negara ke kaltim. Sekedar mengingatkan buat kalian yang nanti pindah : Be Careful With Your Wishes. We Are Full Of Mystic. KEPUHUNAN IS REAL #IKN #kepuhunan #GooglingAjaArtinyaApa","1190689049607995393","","","in","New York, USA","0","0","0","https://twitter.com/imnotdidit/status/1190689049607995393","524208248","imnotdidit"
"1192610304191909889","Fri Nov 08 01:10:28 +0000 2019","0","Memerangi kegelapan di rumah-rumah penduduk yang belum teraliri listrik di Kabupaten Penajam Paser Utara yang telah ditetapkan sebagai calon ibu kota negara baru di Provinsi Kalimantan Timur melalui program Penajam Paser Utara Bersinar terus berlanjut. https://t.co/8IdPfs1cnc","1192610304191909889","","","in","samarinda","0","0","0","https://twitter.com/Kaltim_ANTARA/status/1192610304191909889","560055446","Kaltim_ANTARA"
