"conversation_id_str","created_at","favorite_count","full_text","id_str","image_url","in_reply_to_screen_name","lang","location","quote_count","reply_count","retweet_count","tweet_url","user_id_str","username"
"1179384614101630983","Wed Oct 02 13:16:18 +0000 2019","4","Menteri PPN/Kepala Bappenas menteri dan sejumlah pemred dari media nasional &amp; media lokal akan tinjau lokasi Ibu Kota Negara (IKN)baru di Penajam Paser Utara pada Rabu mendatang. #SiapPindahIbuKota https://t.co/3muzXxY4uF","1179384614101630983","https://pbs.twimg.com/media/EF4EBzuX0AEHqUR.jpg","","in","Aceh, Indonesia","1","1","5","https://twitter.com/beritaaceh/status/1179384614101630983","90836737","beritaaceh"
"1180870298075197441","Sun Oct 06 15:39:53 +0000 2019","15","Setelah resmi ditetapkan sebagai lokasi pemindahan Ibu Kota Negara (IKN) Indonesia. Pemerintah terus menggenjot pembangunan infrastruktur di Wilayah Kalimantan Timur salah satunya adalah proyek pembangunan jembatan Pulau Balang. via @BappenasRI https://t.co/uO2uzdq5Nq","1180870298075197441","https://pbs.twimg.com/ext_tw_video_thumb/1179615468836941824/pu/img/yX8LjFFb80mF36pd.jpg","","in","","0","1","6","https://twitter.com/RadioElshinta/status/1180870298075197441","121640063","RadioElshinta"
"1179982574514425856","Fri Oct 04 04:52:23 +0000 2019","40","Menteri @KemenPU resmi membuka sayembara ide desain kawasan IKN tingkat nasional. Ini bertujuan u/ memperoleh berbagai ide desain kawasan melalui partisipasi masyrakat khususnya yg berkecimpung pd bdg arsitektur perencanaan &amp; perancangan kota di Indonesia https://t.co/YZhoRTTphZ https://t.co/MHvy4INlA0","1179982574514425856","https://pbs.twimg.com/media/EGAj5AKUwAA-uI-.jpg","","in","Bali, Indonesia","3","3","24","https://twitter.com/LaksonoAntonius/status/1179982574514425856","1045579914613645312","LaksonoAntonius"
"1179390608659623939","Wed Oct 02 13:44:01 +0000 2019","4","Jarak ibu kota negara (IKN) Kalimantan Timur ke 34 Provinsi. #SiapPindahIbuKota https://t.co/bqr3fdr2Vc","1179391590122606594","https://pbs.twimg.com/media/EF4KY71XkAEjeRG.jpg","bandaacehinfo","in","Indonesia","1","1","3","https://twitter.com/bandaacehinfo/status/1179391590122606594","269284844","bandaacehinfo"
"1179394822655954948","Wed Oct 02 13:56:52 +0000 2019","21","Progres Pembangunan Jembatan Pulau Balang Pembangunan infrastruktur pendukung Ibu Kota Negara (IKN) di Provinsi Kalimantan Timur terus dikerjakan. Jembatan Pulau Balang akan menjadi akses utama penghubung Balikpapan-Penajam Paser #siappindahibukota https://t.co/0IoFeOyIt0","1179394822655954948","https://pbs.twimg.com/media/EF4NH1MW4AAW2Gh.jpg","","in","","0","0","5","https://twitter.com/Milamariamey/status/1179394822655954948","3171640176","Milamariamey"
"1179375425581178882","Wed Oct 02 12:39:47 +0000 2019","0","Pemindahan IKN baru ke Kalimantan Timur dengan mempertimbangkan banyak aspek penentuannya tidak sembarang karena melihat banyak faktor pendukung yg ideal untuk wajah baru Ibu Kota Negara nantinya #Siappindahibukota https://t.co/zMvvVpscNM","1179375425581178882","https://pbs.twimg.com/media/EF37sJ8W4AAnhBz.jpg","","in","dunia lain","0","0","0","https://twitter.com/Merlg97/status/1179375425581178882","1882749973","Merlg97"
"1179722072676679680","Thu Oct 03 11:37:14 +0000 2019","2","Selamat malam #investeam Pemindahan Ibu Kota Negara (IKN)/ Pusat Pemerintahan merupakan salah satu rencana Pemerintah dalam memperbaiki kondisi ketimpangan antara wilayah yang sudah terencana dan terprogram dengan baik. #InvestasiUntukKita #InvestIndonesiaNOW #BKPMinfo https://t.co/qH8RUAGLYw","1179722072676679680","https://pbs.twimg.com/media/EF826l8UYAAfSjB.jpg","","in","Jakarta - Indonesia","0","1","1","https://twitter.com/bkpm/status/1179722072676679680","106035510","bkpm"
"1179999712822353925","Fri Oct 04 06:00:29 +0000 2019","0","Wilayah ibu kota baru bisa diperluas hingga 180 ribu hektare dari tahap awal yang mencapai 40 ribu hektare. https://t.co/KP1OdkBpNE https://t.co/j4OZTH5C30","1179999712822353925","https://pbs.twimg.com/media/EGAzfEoWsAALq0c.jpg","","in","Bontang, Kaltim, Indonesia","0","0","0","https://twitter.com/bontang_post/status/1179999712822353925","3101199283","bontang_post"
"1181020237858140160","Mon Oct 07 01:35:47 +0000 2019","11","Kehadiran Jembatan Pulau Balang II akan memperlancar konektivitas antara Samarinda Balikpapan dengan Ibu Kota Negara (IKN) baru di Kabupaten Penajam Paser Utara #PUPRSigapMembangunNegeri https://t.co/3obG4fPncx","1181020261904048130","https://pbs.twimg.com/media/EGPTqZIVUAAKEhq.jpg","KemenPU","in","Jl. Pattimura no.20","0","1","4","https://twitter.com/KemenPU/status/1181020261904048130","179835283","KemenPU"
"1179267878346002434","Wed Oct 02 05:32:26 +0000 2019","0","ISRAN DESAK RAMPUNGKAN RUU PEMINDAHAN IKN KPFM BALIKPAPAN - Pemindahan Ibu Kota Negara (IKN) ke Provinsi Kalimantan Timur (Kaltim) ditargetkan mulai dilaksanakan pada tahun 2020 mendatang. Saat ini Pemerintah... https://t.co/PbRgcjC45v","1179267878346002434","","","in","Balikpapan, Kalimantan Timur","0","0","0","https://twitter.com/BimaSaputra2017/status/1179267878346002434","873015522312413184","BimaSaputra2017"
"1179914221955338240","Fri Oct 04 00:20:46 +0000 2019","1","Prof. Masjaya : UNMUL Siap Kawal Pemindahan IKN di Kaltim Kami ada dibelakang pak menteri untuk segera mewujudkan Ibu kota negara di Kalimantan Timur tahun 2024 mendatang tutur Rektor. Selengkapnya : https://t.co/yv6NNzjNTL #Unmul #Indonesia #IKN #IbuKotaNegara https://t.co/4AQ8LnDpJG","1179914221955338240","https://pbs.twimg.com/media/EF_lrwAUwAEHihA.jpg","","in","Kalimantan Timur, Indonesia","1","0","4","https://twitter.com/unmul/status/1179914221955338240","77526546","unmul"
"1181047637325176833","Mon Oct 07 03:24:34 +0000 2019","5","Pemerintah melalui Kementerian PU-Pera tengah mengembangkan enam kota yakni Palembang Banjarmasin Makassar Manado dan Denpasar serta Ibu Kota Negara (IKN) di Kalimantan Timur. https://t.co/1OCrMXeJDF","1181047637325176833","","","in","Jakarta - Indonesia","0","0","4","https://twitter.com/mediaindonesia/status/1181047637325176833","68930552","mediaindonesia"
"1179329820351705088","Wed Oct 02 09:38:34 +0000 2019","1","Menteri Pekerjaan Umum dan Perumahan Rakyat (PUPR) menyebut hadiah sayembara IKN ini dinilai total Rp 5 miliar. https://t.co/zIMpQyTf5N","1179329820351705088","","","in","Jakarta","0","2","3","https://twitter.com/kompascom/status/1179329820351705088","23343960","kompascom"
"1179550265143201794","Thu Oct 03 00:14:32 +0000 2019","4","Mayoritas dari total 180.000 hektar tanah yang disiapkan untuk IKN baru berstatus kawasan hutan. https://t.co/XKs8Vs9yoy","1179550265143201794","","","in","Jakarta","1","1","0","https://twitter.com/kompascom/status/1179550265143201794","23343960","kompascom"
"1179718312818724864","Thu Oct 03 11:22:18 +0000 2019","1","Dari ibu kota negara yang baru cukup 30 menit ke bandara https://t.co/EUZFvw03AL","1179718312818724864","","","in","","0","0","1","https://twitter.com/IDNTimes/status/1179718312818724864","388190238","IDNTimes"
"1180364667757191168","Sat Oct 05 06:10:41 +0000 2019","0","Desain kawasan Ibu Kota Negara (IKN) baru di Kalimantan disayembarakan. Kementerian PUPR RI berharap desain itu melahirkan rancangan yang mencerminkan identitas bangsa. IKN baru nanti akan dihuni oleh generasi https://t.co/8h3LjdQlfi","1180364667757191168","","","in","Wisma Mas Isman Jakarta","0","0","1","https://twitter.com/timescoid/status/1180364667757191168","1052798082419580928","timescoid"
"1179377805718642690","Wed Oct 02 13:03:42 +0000 2019","0","@mediaindonesia PTPIKN Pembangunan Terpadu Pesisir Ibu Kota Negara. Nanti kan ikn nya pindah. Apakah program ini msh lanjut di utara jkt?","1179381441270046721","","mediaindonesia","in","","0","0","0","https://twitter.com/kerrripoet/status/1179381441270046721","243134045","kerrripoet"
"1179402000301199362","Wed Oct 02 14:25:23 +0000 2019","0","Pemerintah bisa jual tanah untuk menambah ongkos pindah IKN https://t.co/X1TMKm6cxP","1179402000301199362","","","in","","0","0","0","https://twitter.com/IDNTimes/status/1179402000301199362","388190238","IDNTimes"
"1179380043090419713","Wed Oct 02 12:58:08 +0000 2019","3","Pembangunan infrastruktur pendukung Ibu Kota Negara (IKN) di Provinsi Kalimantan Timur terus dikerjakan. @jokowi @samsul_ibr @shafigh @eko_kuntadhi @richardodhstio @SakinahMudhiiah @iwanchan_ @Milamariamey @zlametabidin @StellaSuwardi @baciritaID #SiapPindahIbukota","1179380043090419713","","","in","Jakarta","0","0","3","https://twitter.com/ihadrianip/status/1179380043090419713","1124345881","ihadrianip"
"1180241416984895488","Fri Oct 04 22:00:56 +0000 2019","0","Bupati Penajam Paser Utara Abdul Gafur Mas'ud mengatakan warga setempat jangan sampai terpinggirkan dengan adanya pemindahan ibu kota negara (IKN) dari Jakarta ke Kalimantan Timur khususnya di Kabupaten Penajam Paser Utara dan Kabupaten Kutai... https://t.co/BxdySRrkaA","1180241416984895488","","","in","samarinda","0","0","0","https://twitter.com/Kaltim_ANTARA/status/1180241416984895488","560055446","Kaltim_ANTARA"
"1179713341243232256","Thu Oct 03 11:02:33 +0000 2019","0","Menteri Pekerjaan Umum dan Perumahan Rakyat (PUPR) Basuki Hadimuljono resmi meluncurkan Sayembara Gagasan Desain Kawasan Ibu Kota Negara (IKN) di Balikpapan Kalimantan Timur Rabu. https://t.co/H45zSRCVVL","1179713341243232256","","","in","samarinda","0","0","0","https://twitter.com/Kaltim_ANTARA/status/1179713341243232256","560055446","Kaltim_ANTARA"
"1179240131888320512","Wed Oct 02 03:42:11 +0000 2019","0","Ibu kota akan menjadi trend setter bagi kota lain https://t.co/VuT7ujyfEc","1179240131888320512","","","in","","0","0","0","https://twitter.com/IDNTimes/status/1179240131888320512","388190238","IDNTimes"
"1179326994460430338","Wed Oct 02 09:27:20 +0000 2019","0","WALIKOTA NGOTOT MINTA PEMERINTAH PUSAT BANGUN BALIKPAPAN AJUKAN RP 50 TRILIUN TUNTASKAN PROYEK INFRASTRUKTUR Walikota Balikpapan Rizal Effendi ngotot Balikpapan harus dibenahi sebelum Ibu Kota Negara (IKN) dibangun. https://t.co/NFKtQZycBP","1179326994460430338","","","in","Balikpapan, Indonesia","0","1","0","https://twitter.com/tribunkaltim/status/1179326994460430338","103551225","tribunkaltim"
"1179671091742040064","Thu Oct 03 08:14:40 +0000 2019","0","Wali Kota: Jangan nanti ibu kota maju kita masih kampungan https://t.co/K5aJ0eh8tG","1179671091742040064","","","in","","0","0","0","https://twitter.com/IDNTimes/status/1179671091742040064","388190238","IDNTimes"
"1179062453981913089","Tue Oct 01 15:56:09 +0000 2019","0","PUSAT PEMERINTAHAN IKN DI KECAMATAN SEPAKU KAB. PPU. : Berdasarkan pernyataan Kepala Bappenas Bambang Brodjonegoro dalam kegiatan Talkshow Rancang Bangun dan Kesiapan Kaltim sebagai Ibu Kota Negara Selasa (1/10) https://t.co/QTQ5W6upSq","1179062453981913089","","","in","Balikpapan","0","0","0","https://twitter.com/balikpapancrime/status/1179062453981913089","2797007827","balikpapancrime"
"1179395985950334976","Wed Oct 02 14:01:29 +0000 2019","0","PEMBANGUNAN IKN DI KALTIM BUTUH Rp 460 TRILIUN MENTERI PUPR: ITU MASIH HITUNGAN KASAR BISA LEBIH! Setelah resmi memboyong ibukota negara Indonesia (IKN) dari Jakarta ke Kalimantan Timur. https://t.co/WeFWB6B8L9","1179395985950334976","","","in","Balikpapan, Indonesia","0","0","0","https://twitter.com/tribunkaltim/status/1179395985950334976","103551225","tribunkaltim"
"1179220494366773249","Wed Oct 02 02:24:09 +0000 2019","0","Ditanya Soal Pansus Pemindahan Ibu Kota Negara Begini Tanggapan Bambang Kepala Bappenas: Menteri PPN/Bappenas Bambang Brodjonegoro memastikan pusat pemerintahan Ibu Kota Negara (IKN) berada di kecamatan Sepaku Penajam Paser Utara. https://t.co/FtHJnBLAHr","1179220494366773249","","","in","Kalimantan Timur, Indonesia","0","0","0","https://twitter.com/KaltimBerita/status/1179220494366773249","1536217758","KaltimBerita"
"1180090128628252675","Fri Oct 04 11:59:46 +0000 2019","0","JADI IBU KOTA NEGARA 2020 JUMLAH PENDUDUK KALTIM DIPREDIKSI CAPAI 3 7 JUTA Ditunjuknya Kaltim menjadi Ibu Kota Negara (IKN) menjadikan daerah kaya akan sumber daya alam (SDA) ini semakin diminati untuk didatangi. https://t.co/FgAX4xwr1i","1180090128628252675","","","in","Balikpapan, Indonesia","0","0","0","https://twitter.com/tribunkaltim/status/1180090128628252675","103551225","tribunkaltim"
"1180070672745160704","Mon Oct 07 07:23:37 +0000 2019","0","https://t.co/vUh3Cq0x8i Video Bag 1: Menteri @KemenPU Pak Basuki Hadimuljono soal pemindahan Ibukota Negara (IKN) #suaramillennial by @idntimes","1181107795652792321","","unilubis","in","Indonesia","0","0","0","https://twitter.com/unilubis/status/1181107795652792321","85087815","unilubis"
