"conversation_id_str","created_at","favorite_count","full_text","id_str","image_url","in_reply_to_screen_name","lang","location","quote_count","reply_count","retweet_count","tweet_url","user_id_str","username"
"1193706180595478528","Mon Nov 11 01:45:06 +0000 2019","14","Ibu Kota Negara (IKN) baru Harusnya jadi kota percontohan nih bukan hanya untuk Indonesia tetapi juga dunia Kera Ngalam pastinya banyak yang akan kesana bisa menggelorakan semangat Nasionalisme dan tentunya salam satu jiwa nih https://t.co/HF8ldKM7vx","1193706180595478528","https://pbs.twimg.com/media/EJDlbDmU4AA9PFj.jpg","","in","Malang, Jawa Timur","1","0","4","https://twitter.com/dpuprpkp_MalKot/status/1193706180595478528","760651143219294208","dpuprpkp_MalKot"
"1194935952973520896","Thu Nov 14 11:11:46 +0000 2019","13","#SahabatPembangunan mari kita bersama-sama mempersiapkan Ibu Kota Negara. Persiapan Pemindahan IKN masih terus dilaksanakan seluruh elemen bersiap-siap untuk mendukung pembangunan IKN di Provinsi Kalimantan Timur contohnya Pemkot Balikpapan dan Pertamina. https://t.co/5XZ0IwmcVv","1194935952973520896","https://pbs.twimg.com/media/EJVD5_GU0AI78e7.jpg","","in","Jakarta","2","2","4","https://twitter.com/BappenasRI/status/1194935952973520896","235021856","BappenasRI"
"1195271110503256064","Fri Nov 15 09:23:34 +0000 2019","11","#SahabatPembangunan Pagi tadi Jumat (15/11/2019) di Gedung Bappenas Jakarta dilaksanakan pertemuan untuk membahas Rancangan Perpres tentang Badan Otorita Persiapan Pemindahan dan Pembangunan Ibu Kota Negara (IKN). https://t.co/ETp8xg0flM","1195271110503256064","https://pbs.twimg.com/media/EJZ0qTMUUAA06QJ.jpg","","in","Jakarta","0","1","1","https://twitter.com/BappenasRI/status/1195271110503256064","235021856","BappenasRI"
"1194053056595283968","Tue Nov 12 00:43:27 +0000 2019","0","Kawal Pemindahan Ibu Kota Politisi Demokrat Ini Usulkan RUU IKN https://t.co/a2jcJ4TTqM https://t.co/Fdqw43lPWS","1194053056595283968","https://pbs.twimg.com/media/EJIg7WRVUAAkmWu.jpg","","in","Cipete, Jakarta Selatan","0","0","0","https://twitter.com/MonitorCOID/status/1194053056595283968","3029835496","MonitorCOID"
"1195951870067347456","Sun Nov 17 06:28:40 +0000 2019","0","KOTAKU BALIKPAPAN-Dewan Perwakilan Rakyat Daerah (DPRD) Kota Balikpapan mencatat ada sejumlah permasalahan dampak dari penetapan Ibu Kota Negara (IKN) yang baru yang berlokasi di Kabupaten Penajam Paser Utara (PPU) dan Kabu https://t.co/sN2Vjvk3vG","1195951870067347456","","","in","Balikpapan, Kalimantan Timur","0","0","0","https://twitter.com/kotaku_news/status/1195951870067347456","1168726480056045572","kotaku_news"
"1195176052051460128","Fri Nov 15 03:05:50 +0000 2019","0","Jum'at 15 November 2019 @djplkemenhub151 #KawanLaut . Badan Penelitian dan Pengembangan Kementerian Perhubungan mengadakan Forum Group Discussion Perihal Studi Pendahuluan Ibu Kota Negara(IKN) yang dilaksanakan di https://t.co/98syewUMa8","1195176052051460128","","","in","Jl. Yos Sudarso, Prapatan, Bal","0","0","0","https://twitter.com/DJPL_KSOPBPN/status/1195176052051460128","1116148486037102594","DJPL_KSOPBPN"
"1194084127336734720","Tue Nov 12 02:46:55 +0000 2019","4"," Saya sangat sepakat akan satu usulan penting terkait UU Ibu Kota Negara (IKN). Karena bagaimanapun mitra kita Kementerian PUPR pada tahun depan mereka telah menyampaikan akan memulai program pelaksanaan pembangunan fisik. (H.Irwan). https://t.co/eNyRKPmkzz","1194084127336734720","","","in","Kalimantan Timur","0","0","0","https://twitter.com/suara_irwan/status/1194084127336734720","992654911383846913","suara_irwan"
"1195248964116733952","Fri Nov 15 07:55:35 +0000 2019","8","Oleh karena itu dalam membangun Ibu Kota Negara (IKN) baru di wilayah Kalimantan Timur semangat yang sama akan dijaga. #SahabatPembangunan","1195248968361365504","","shafigh","in","Indonesia","0","1","9","https://twitter.com/shafigh/status/1195248968361365504","58711038","shafigh"
"1195209332952047617","Fri Nov 15 05:18:05 +0000 2019","19","Pemerintah tengah menyusun pembentukan badan otorita ibu kota negara (IKN) di Kalimantan Timur. Siapa yang bakal pimpin badan tersebut? #IKN via @detikfinance https://t.co/aoOIZyiqXr","1195209332952047617","","","in","","0","4","1","https://twitter.com/detikcom/status/1195209332952047617","69183155","detikcom"
"1195216324861018113","Fri Nov 15 05:45:52 +0000 2019","1","Pemerintah tengah menyusun pembentukan badan otorita ibu kota negara (IKN) di Kalimantan Timur. Siapa yang bakal pimpin badan tersebut? #IKN https://t.co/Z8Peuzb6Xu","1195216324861018113","","","in","Jakarta, Indonesia","0","0","0","https://twitter.com/detikfinance/status/1195216324861018113","135795460","detikfinance"
"1195513102181076992","Sat Nov 16 01:25:09 +0000 2019","19","Pembangunan Ibukotabaru ditargetkan Kelar selama 3 tahun Sedang dibentuk Badan Otorita (BO) Persiapan Pemindahan dan Pembangunan IKN. https://t.co/Oas2YAlGb6 @positive_values @DjanChoek @jonahmunda @RosaErna @FachryAditya9 @ediedot108 @regina999999 @Boemi_Pertiwi12","1195513102181076992","","","in","Jakarta Capital Region, Indone","0","5","4","https://twitter.com/cagubnyinyir2/status/1195513102181076992","1013331201396912128","cagubnyinyir2"
"1195147036271636481","Fri Nov 15 01:10:32 +0000 2019","3","Teluk Balikpapan memberikan akses yang lebih efektif menuju IKN baru selama masa tahapan konstruksi. https://t.co/OINsl9VeXX","1195147036271636481","","","in","Jakarta","0","0","0","https://twitter.com/kompascom/status/1195147036271636481","23343960","kompascom"
"1194966282795241473","Thu Nov 14 13:21:59 +0000 2019","2","Jadi Menurut Kalian pentingkah Mangrove di Teluk Balikpapan? Atau harus dihancurkan demi pembangunan Ibukota Kota Negara (IKN)? Yuk Sharing Bareng","1194968721179074560","","fwindonesia","in","Sempur Kaler 62, Bogor","0","0","1","https://twitter.com/fwindonesia/status/1194968721179074560","1692738108","fwindonesia"
"1196357715162910722","Mon Nov 18 09:21:21 +0000 2019","1","Badan otorita segera dibentuk karena tugasnya mengawal pembangunan IKN di Kaltim https://t.co/1Nl6k76vLQ","1196357715162910722","","","in","Jakarta, Indonesia","0","0","0","https://twitter.com/republikaonline/status/1196357715162910722","22126902","republikaonline"
"1194153028082786304","Tue Nov 12 07:20:42 +0000 2019","0","#kom5 Rifqi @PDI_Perjuangan #kalsel1 : minggu dpn kita akan rapat IKN. Ada ganjalan yuridis UU msh menempatkan Jakarta sbg ibukota. Kami mengusulkan pansus pembahasan UU ibukota yg baru. Kami sdg mendorong jembatan di Pulau Laut bbrp pihak swasta siap memberi dana..(1)","1194153028082786304","","","in","","0","0","0","https://twitter.com/WikiDPR2/status/1194153028082786304","3550853180","WikiDPR2"
"1195022713770795009","Thu Nov 14 16:56:32 +0000 2019","0","Kementerian Perencanaan Pembangunan Nasional/Badan Perencanaan Pembangunan Nasional atau PPN/Bappenas berencana akan membahas kematangan lokasi ibu kota negara Indonesia yang telah ditetapkan dipindahkan ke wilayah Provinsi Kalimantan Timur. https://t.co/224ehPdvXd","1195022713770795009","","","in","samarinda","0","0","0","https://twitter.com/Kaltim_ANTARA/status/1195022713770795009","560055446","Kaltim_ANTARA"
"1195187330312736768","Fri Nov 15 03:50:39 +0000 2019","0","Reposted from @PemkotBPN (@get_regrann) - Balikpapan mempersiapkan diri untuk menjadi kota penopang Ibu Kota Negara (IKN). #Repost from bappenasri #SahabatPembangunan mari kita bersama-sama mempersiapkan Ibu https://t.co/8J9RxbmRhS","1195187330312736768","","","in","Balikpapan Selatan, Indonesia","0","0","0","https://twitter.com/smartfm_bpn/status/1195187330312736768","125928092","smartfm_bpn"
"1196628940816650240","Tue Nov 19 03:19:06 +0000 2019","0","@FraksiPKB di Baleg sepakat mendorong agar RUU IKN masuk Prolegnas prioritas 2020 ini sangat urgent demi efektivitas dan efisiensi percepatan pembangunan Ibu Kota Negara Baru di Pulau Kalimantan. @DPR_RI @jokowi @Kemendagri_RI @WikiDPR2 @DPP_PKB @FraksiPKB @cakimiNOW","1196628940816650240","","FraksiPKB","in","DKI Jakarta, Indonesia","0","0","0","https://twitter.com/nengeemofficiaI/status/1196628940816650240","1190583007737892864","nengeemofficiaI"
"1195512140301340672","Sat Nov 16 01:21:20 +0000 2019","0","Pembangunan Ibukotabaru ditargetkan Kelar selama tiga tahun Sedang dibentuk Badan Otorita (BO) Persiapan Pemindahan dan Pembangunan IKN. https://t.co/Oas2YAlGb6 @valencia_amara","1195512140301340672","","","in","Jakarta Capital Region, Indone","0","0","0","https://twitter.com/cagubnyinyir2/status/1195512140301340672","1013331201396912128","cagubnyinyir2"
"1194935952973520896","Thu Nov 14 11:11:47 +0000 2019","2","#SahabatPembangunan sudah mempersiapkan apa untuk Pemindahan IKN? Tulis di kolom komentar ya. Ikuti terus informasi pemindahan Ibu Kota Baru di media sosial Kementerian PPN/Bappenas. #bersamaindonesiamaju #SiapPindahIbuKota #Bappenas #Pembangunan","1194935957167886336","","BappenasRI","in","Jakarta","0","1","0","https://twitter.com/BappenasRI/status/1194935957167886336","235021856","BappenasRI"
