"conversation_id_str","created_at","favorite_count","full_text","id_str","image_url","in_reply_to_screen_name","lang","location","quote_count","reply_count","retweet_count","tweet_url","user_id_str","username"
"1176697104003039232","Wed Sep 25 03:17:06 +0000 2019","0","Panitia Khusus (Pansus) pemindahan Ibu Kota Negara (IKN) DPR-RI dalam kunjungan kerjanya ke Provinsi Kaltim melakukan pertemuan dengan Gubernur Kaltim Bupati Penajam Paser Utara dan Bupati Kutai Kartanegara guna mendapatkan informasi sebanyak... https://t.co/poDQVdGUSK","1176697104003039232","","","in","samarinda","0","0","0","https://twitter.com/Kaltim_ANTARA/status/1176697104003039232","560055446","Kaltim_ANTARA"
"1176931482352439298","Wed Sep 25 18:48:26 +0000 2019","0","Pemerintah akan melibatkan pihak luar dalam membuat gagasan desain kawasan Ibu Kota Negara (IKN) baru di Kalimantan Timur. Akan dibuka sayembara https://t.co/sQH9gZ8YtX","1176931482352439298","","","in","Jakarta, Indonesia","0","0","1","https://twitter.com/detikfinance/status/1176931482352439298","135795460","detikfinance"
"1177542931177201664","Fri Sep 27 11:18:07 +0000 2019","1","Kepala BPIW Kementerian PUPR Hadi Sucahyono mengatakan untuk bisa membangun infrastruktur di IKN perlu payung hukum. Seperti apa penuturannya? #IbuKotaBaru #KementerianPUPR https://t.co/eUVwcbhnkO","1177542931177201664","","","in","Jakarta, Indonesia","0","0","0","https://twitter.com/detikfinance/status/1177542931177201664","135795460","detikfinance"
"1176922780983578625","Wed Sep 25 18:13:51 +0000 2019","1","Untuk merealisasikan rencana pemindahan Ibu Kota Negara (IKN) pemerintah membahasnya dengan Dewan Perwakilan Rakyat (DPR). https://t.co/vfLgGnlTKz","1176922780983578625","","","in","Jakarta, Indonesia","0","0","1","https://twitter.com/detikfinance/status/1176922780983578625","135795460","detikfinance"
"1176418288634490880","Tue Sep 24 08:49:11 +0000 2019","4","Majlis Perasmian Butik The Bujins Batik Encik Amir Harith Mat Kashim (Pengasas Bujins Batik) merupakan bekas pelajar Institut Kraf Negara (IKN) dan usahawan batik berdaftar dibawah Kraftangan Malaysia. #MyMotac #MalaysiaTrulyAsia #SeniBudaya #VisitMalaysia https://t.co/TIdTEtsWXp","1176418288634490880","https://pbs.twimg.com/media/EFN6K0WUwAAbhID.jpg","","in","Putrajaya, Putrajaya Federal T","0","0","2","https://twitter.com/MyMOTAC/status/1176418288634490880","145501511","MyMOTAC"
"1177592163347193856","Fri Sep 27 14:33:45 +0000 2019","3","Kepala BPIW Kementerian PUPR Hadi Sucahyono mengungkapkan beratnya tugas memindahkan ibu kota negara (IKN). Begini ungkapannya: #PUPR https://t.co/pU0bpGLUhg","1177592163347193856","","","in","Jakarta, Indonesia","0","1","0","https://twitter.com/detikfinance/status/1177592163347193856","135795460","detikfinance"
"1176857178189127685","Wed Sep 25 13:53:10 +0000 2019","0","#Pansus #PemindahanIbuKota Menteri PUPR: kebutuhan infrastruktur IKN * Sumber daya udara: kebutuhan air baku penanganan banjir drainase dan infrastruktur energi ....","1176857178189127685","","","in","","0","0","0","https://twitter.com/WikiDPR1/status/1176857178189127685","3550695012","WikiDPR1"
"1176959342991564800","Wed Sep 25 20:39:08 +0000 2019","3","Panitia Khusus (Pansus) pemindahan Ibu Kota Negara (IKN) hari ini menggelar rapat kajian bersama dengan pemerintah pusat. https://t.co/sd8O4yUfvD","1176959342991564800","","","in","Jakarta, Indonesia","0","1","0","https://twitter.com/detikfinance/status/1176959342991564800","135795460","detikfinance"
