"conversation_id_str","created_at","favorite_count","full_text","id_str","image_url","in_reply_to_screen_name","lang","location","quote_count","reply_count","retweet_count","tweet_url","user_id_str","username"
"1208615962359894016","Sun Dec 22 05:11:15 +0000 2019","6","wangi'a wangi bngt [menyrmprot pstisida] tp tahukh km bhw mnyak wngi bhn dsar'a bkan mnyak mlainkn kwah rujakk cnguur dr psaar kemis.. ywaa stiap hrii kamsii ak k psaar genjing.. mmbeli ikn cupang utk diadu brsama ayam broilr tiptop rwmangun ywdh https://t.co/iN47CevhQy","1208615962359894016","https://pbs.twimg.com/media/EMXdxv9UwAMILl2.png","","in","MY FRIEND’S HOMETOWN","1","1","3","https://twitter.com/moonwalkink/status/1208615962359894016","4826632311","moonwalkink"
"1209155621955620872","Mon Dec 23 16:55:39 +0000 2019","6","Selamat untuk Almamaterku @unikasoegija Semarangjuara 2 Proficiat untuk Bapak Ardiyanto &amp; tim JUARA ke-2 SAYEMBARA IBUKOTA NEGARA (sayembara tingkat internasional)... Cc Pak @ganjarpranowo Mas @hendrarprihadi @BappenasRI #SahabatPembangunan #IKN #SiapPindahIbukota https://t.co/k4Ll7Xua5H","1209155621955620872","https://pbs.twimg.com/ext_tw_video_thumb/1209154680112050176/pu/img/D-5jXVEHfNc4Cdrr.jpg","","in","Indonesia","0","1","3","https://twitter.com/shafigh/status/1209155621955620872","58711038","shafigh"
"1209406389803597826","Tue Dec 24 09:32:07 +0000 2019","1","\\ Sejenak menghayati desain ikn dulu Cc. @aocifloe (*rendernya mantapu) https://t.co/t1tOOq0qIE","1209406389803597826","https://pbs.twimg.com/media/EMisrpQUYAAB7Tm.jpg","","in","Loading . . . ","1","1","0","https://twitter.com/rasasvaad/status/1209406389803597826","986229043140767745","rasasvaad"
"1209078968504029184","Mon Dec 23 11:51:04 +0000 2019","1","Sedih liat pengumuman sayembara IKN","1209078968504029184","","","in","Indonesia","0","0","0","https://twitter.com/man_mus/status/1209078968504029184","515055347","man_mus"
"1208640943840059393","Sun Dec 22 06:50:31 +0000 2019","2","Membangun IKN Simultan dengan Pemulihan Lingkungan @KementerianLHK @FORDA_MoF @djatiwh #kabaralam https://t.co/SsXXz3WAr1","1208640943840059393","","","in","Indonesia","0","0","1","https://twitter.com/kabarlhk/status/1208640943840059393","950002951824666624","kabarlhk"
"1209419525831217152","Tue Dec 24 10:24:19 +0000 2019","5","Setiap ngobrol dengan rekan profesi lain (selain arsitek desainer dan dll) komen pertama mereka soal sayembara IKN adalah reward pemenangnya dirasa kecil. Semoga dampak sayembara dan kemungkinan dampak lain dari aktivitas ini perbaikan salary di profesi ini juga bisa didorong.","1209419525831217152","","","in","Manchester, England","0","0","2","https://twitter.com/brmstrsp/status/1209419525831217152","138971561","brmstrsp"
"1208285153052610562","Sat Dec 21 07:16:43 +0000 2019","1","2 hr lagi pengumuman pemenang sayembara IKN ","1208285153052610562","","","in","","0","3","0","https://twitter.com/is_a_cheese/status/1208285153052610562","178341515","is_a_cheese"
"1209364316048117760","Tue Dec 24 06:44:56 +0000 2019","2","Keren sekaliiiii urbanplus menang sayembara ikn ku teringat dulu waktu magang pak sib sharing ttg rencana pemindahan ibukota di kantor dan dia bilang pengen ikut sayembaranya nanti hihi https://t.co/uP5LWpn9g1","1209364316048117760","https://pbs.twimg.com/media/EMiGbYcUUAA_2K7.jpg","","in","","1","1","0","https://twitter.com/nabvla/status/1209364316048117760","111574239","nabvla"
"1210120225221267456","Thu Dec 26 08:48:39 +0000 2019","5","Pemerintah telah mengumumkan pemenang dari Sayembara Desain Ibu Kota Negara (IKN) tersebut. kira-kira seperti apa sih desain Ibu Kota Baru Indonesia? #ibukotabaru https://t.co/zk60mje8mS","1210120225221267456","","","in","DKI Jakarta, Indonesia","0","0","3","https://twitter.com/indonesiacraft_/status/1210120225221267456","1133572741146144769","indonesiacraft_"
"1209003868224245761","Mon Dec 23 06:52:39 +0000 2019","1","Gila2 urb4nplez menang masterplen ikn waaaa sedih jd mskin susa da untuk masuk kesiTu kembAliiiiiii","1209003868224245761","","","in","","0","2","1","https://twitter.com/____sssshhhh/status/1209003868224245761","133938741","____sssshhhh"
"1210161051175571456","Thu Dec 26 11:40:03 +0000 2019","1","@jeoriana_ Jd ank ikn?","1210163360513150977","","bungaisme_","in","Nilai","0","1","0","https://twitter.com/misterigai/status/1210163360513150977","1192763115537985536","misterigai"
"1210258665833291777","Thu Dec 26 17:58:46 +0000 2019","0","Ak sprrti ikn bsar di empang","1210258665833291777","","","in","","0","1","1","https://twitter.com/kikicurutt/status/1210258665833291777","1105509703314944000","kikicurutt"
"1209030566554718215","Mon Dec 23 08:38:44 +0000 2019","2","Selamat untuk Pak @rahmanaw dan tim Urban+ telah meraih Juara Pertama dalam sayembara IKN Kalau ada waktu kapan-kapan sharing sambil ngobrol santai sama kita dong pak. Cerita2 ttg pengalaman sayembara-nya ","1209030566554718215","","","in","Indonesia","0","1","0","https://twitter.com/podcastobroland/status/1209030566554718215","1204650526047997952","podcastobroland"
"1209353039716335616","Tue Dec 24 06:00:08 +0000 2019","1","Pertama kali nonton berita satu soalnya ada yg mau bahas IKN disana","1209353039716335616","","","in","Bekasi","0","1","0","https://twitter.com/GustiDT/status/1209353039716335616","233512113","GustiDT"
"1209350452627685377","Tue Dec 24 05:49:51 +0000 2019","0","Jadi nanti bakal pakai design ini kan ya IKN nya?","1209350452627685377","","","in","Jakarta Capital Region","0","1","1","https://twitter.com/diyasprdn/status/1209350452627685377","4848421215","diyasprdn"
"1208994266611146752","Mon Dec 23 06:14:29 +0000 2019","276","Mantul! Desain Nagara Rimba Nusantara memenangkan sayembara ibu kota negara (IKN) baru di Kaltim Pemilik desain tersebut mengantongi hadiah Rp 2 miliar. #IbuKotaBaru via @detikfinance https://t.co/W3tZGahtqW","1208994266611146752","","","in","","17","22","86","https://twitter.com/detikcom/status/1208994266611146752","69183155","detikcom"
"1209027213510598656","Mon Dec 23 08:25:33 +0000 2019","34","Benarkah pembangunan IKN dirancang modern smart and green city yang memakai energi baru dan terbarukan tidak bergantung kepada energi fosil batubara? https://t.co/f4mB6pUGWi","1209027251049652224","https://pbs.twimg.com/media/EMdT3Y4UwAAmeE3.jpg","jatamnas","in","Indonesia","2","4","21","https://twitter.com/jatamnas/status/1209027251049652224","165334272","jatamnas"
"1208365060831113217","Sat Dec 21 12:34:15 +0000 2019","2","Siapapun Masyarakat Boleh Datang Merantau ke IKN Baru Asalkan... https://t.co/cYlPBACxdh","1208365060831113217","","","in","Balikpapan Indonesia","0","0","0","https://twitter.com/Vicksigit/status/1208365060831113217","149159233","Vicksigit"
"1209036185949081601","Mon Dec 23 09:01:04 +0000 2019","18","Mantul! Desain Nagara Rimba Nusantara memenangkan sayembara ibu kota negara (IKN) baru di Kalimantan Timur. Begini konsepnya: #IbuKotaBaru https://t.co/KDogGKFTBl","1209036185949081601","","","in","Jakarta, Indonesia","1","1","9","https://twitter.com/detikfinance/status/1209036185949081601","135795460","detikfinance"
"1209099052735877120","Mon Dec 23 13:10:52 +0000 2019","6","Wholesome bgt pagi ini ngeliat orang2 di kantor pada sumringah menang sayembara IKN [meski aku ndak berkontribusi apa2...]","1209099052735877120","","","in","Jakarta, ID","0","2","0","https://twitter.com/armiautami/status/1209099052735877120","99399717","armiautami"
"1211630929153863685","Mon Dec 30 12:51:39 +0000 2019","2"," IKN? Yang berenang itu?? &gt; &lt; https://t.co/6DP7edgttz","1211630929153863685","","","in","Indonesia","0","1","0","https://twitter.com/EpelEvelyn/status/1211630929153863685","1060543623509340160","EpelEvelyn"
"1211564109109420034","Mon Dec 30 08:26:08 +0000 2019","2","Nagara Rimba Nusa ini punya kolerasi dengan Jogja dimana Gunung Merapi Tugu &amp; Laut Selatan jadi poros. Tuhan manusia &amp; alam. Semoga proses pembangunan IKN berjalan lancar tanpa ada kecurangan atau pemanfaatan kesempatan secara materiil maupun jabatan. Semangat pak @jokowi","1211564109109420034","","","in","Magelang / Jogja PP","0","0","1","https://twitter.com/wish_key_/status/1211564109109420034","1199165474237321216","wish_key_"
"1208955782575689728","Mon Dec 23 03:47:37 +0000 2019","34","Terpilih sebagai Pemenang Harapan 2 desain IKN dengan judul Banua Rakyat Nusantara. #PUPRSigapMembangunNegeri #SayembaraIKN https://t.co/FinAPS6Mxi","1208957306815139841","https://pbs.twimg.com/media/EMcUQhLVUAwFwBY.jpg","KemenPU","in","Jl. Pattimura no.20","5","1","18","https://twitter.com/KemenPU/status/1208957306815139841","179835283","KemenPU"
"1209445821105655810","Tue Dec 24 12:28:05 +0000 2019","0","@gendengforefer @shitlicious Wah plat IKN","1209450672023695361","","gendengforefer","in","Kalimantan Timur, Indonesia","0","1","0","https://twitter.com/NS_Hamzah/status/1209450672023695361","1837568570","NS_Hamzah"
"1209104388607709186","Mon Dec 23 13:32:04 +0000 2019","1","Berakhir sudah sayembara desain ibu kota negara (IKN) yang digelar Kementerian PUPR. Cc @KemenPU https://t.co/82K4GhEkrQ","1209104388607709186","","","in","Kembangan, Indonesia","0","0","0","https://twitter.com/ceknricekcom_id/status/1209104388607709186","145511335","ceknricekcom_id"
"1210437569403473920","Fri Dec 27 05:49:40 +0000 2019","0","Rencana pemindahan IKN yang akan dilakukan pemerintah paling lambat pada 2024 dinilai sebagai keputusan visioner. Visi pemindahan IKN merupakan respon atas kian berkurangnya daya dukung Jakarta saat ini sebagai IKN. Sumber: https://t.co/b3VFEhPL1X #DolarCairDemoLancar https://t.co/Wrvl5eUSsM","1210437569403473920","https://pbs.twimg.com/media/EMxWi-RU4AUOJir.jpg","","in","Sulawesi Barat, Indonesia","0","0","0","https://twitter.com/InfoNKR1/status/1210437569403473920","1003092530206932992","InfoNKR1"
"1209692975963365376","Wed Dec 25 04:30:55 +0000 2019","1","Tadi pagi wisata hutan hujan Kalimantan ke Bukit Bangkirai di Sepaku Penajam Paser Utara (lokasi IKN baru) dan siang ini sedang berada di Samarinda. Cerita untuk https://t.co/a5oXNfafrL akan saya perbarui secepat mungkin.","1209692975963365376","","","in","","0","0","0","https://twitter.com/dominixb/status/1209692975963365376","41310895","dominixb"
"1209004139226648576","Tue Dec 24 10:15:51 +0000 2019","1","@firatirona @WaniLebaran @Aku_Survivor Itu kena tanya @Aku_Survivor dgn @WaniLebaran ..Za ikut je... cuma jangan 7 &amp; 8 hb sebab za ada appointment kat IKN","1209417394118000640","","7S9entinel_xyz","in","","0","1","0","https://twitter.com/_ChillPills_/status/1209417394118000640","219208560","_ChillPills_"
"1211596310123446272","Mon Dec 30 12:09:30 +0000 2019","1","@shafik_74549 @mxskdpotato @azrayzul yea mak aku suka kalu ikn dia murah.","1211620324778729474","","shafik_74549","in","Malaysia","0","1","0","https://twitter.com/Nurhuda91512404/status/1211620324778729474","942230926477508608","Nurhuda91512404"
"1211128479552434176","Sun Dec 29 03:42:44 +0000 2019","1","@__azza Aku gak mau makan ikan pari karena suka dipake sm nelayan. Mari gt pernah ada bangke ikn pari masih baru gt dibuat mainan foto2 sm wisatawan aku tau abis buat apa parinya dan cm ketawa gak mau pegang2","1211130405258027008","","__azza","in","","7","9","1","https://twitter.com/alvinbolang_/status/1211130405258027008","797863158","alvinbolang_"
"1210100652044505093","Sat Dec 28 09:33:10 +0000 2019","0","@aby_ikn HAHAHAHAHAHA si beri pa ba","1210856204626382848","","aby_ikn","tl","she / her ; 00' jaedo","0","1","0","https://twitter.com/seungyounemy/status/1210856204626382848","1167207379131236352","seungyounemy"
"1209348341714145285","Tue Dec 24 05:57:17 +0000 2019","12","@jokowi Semuanya indah dalam rencana smoga realisasinya tak menghianati 1 hal yg perlu tuan presiden pertimbangkan ditengah ekonomi bangsa (khususnya rakyat) yg amburadul membangun IKN dengan menambah Utang Negara mencedrai &amp; malah tak merepresentasikan semangat #pancasila","1209352325950631937","","jokowi","in","Pekanbaru","0","0","1","https://twitter.com/Rizky2TC/status/1209352325950631937","186453669","Rizky2TC"
"1209102363635548160","Mon Dec 23 13:24:02 +0000 2019","0"," Nagara Rimba Nusa Juara Pertama Sayembara Gagasan Desain IKN https://t.co/ZxljuCwT9y","1209102363635548160","","","in","","0","0","0","https://twitter.com/KompasProperti/status/1209102363635548160","454638631","KompasProperti"
"1209007743979278337","Mon Dec 23 07:08:03 +0000 2019","0","Siap-siap Semester II-2020 Digelar Sayembara Desain Bangunan IKN https://t.co/6IXmMvGQLq","1209007743979278337","","","in","","0","0","0","https://twitter.com/KompasProperti/status/1209007743979278337","454638631","KompasProperti"
"1209175687011028992","Mon Dec 23 22:21:07 +0000 2019","2","@Mas_igi @theashare Keren n bagus IKN.. joss pak. Jokowi","1209237524662517760","","Mas_igi","in","Bojonegoro","0","0","1","https://twitter.com/KonsulWahyu/status/1209237524662517760","1969043107","KonsulWahyu"
"1208955782575689728","Mon Dec 23 04:11:42 +0000 2019","46","Saat meninjau maket pemenang Menteri PUPR Basuki Hadimuljono menyampaikan IKN nantinya tidak hanya harus bagus tapi juga harus memiliki pembeda dengan ibu kota lain di dunia. #PUPRSigapMembangunNegeri #SayembaraIKN https://t.co/yUwkGkOkbi","1208963365369856000","https://pbs.twimg.com/media/EMcZwfxVAAAHeVy.jpg","KemenPU","in","Jl. Pattimura no.20","3","2","14","https://twitter.com/KemenPU/status/1208963365369856000","179835283","KemenPU"
"1209024414341193728","Mon Dec 23 09:56:48 +0000 2019","0","@aby_ikn lahat kayo si mimi hinihintay hahahaha ready narin ba kayo umiyak???","1209050214826270722","","aby_ikn","tl","she / her ; 00' jaedo","0","2","0","https://twitter.com/seungyounemy/status/1209050214826270722","1167207379131236352","seungyounemy"
"1208368400465944576","Sat Dec 21 12:47:31 +0000 2019","12","Siapapun Masyarakat Boleh Datang Merantau ke IKN Baru Asalkan... https://t.co/EwpXtnKq3i","1208368400465944576","","","in","Indonesia","0","0","5","https://twitter.com/kompasiana/status/1208368400465944576","23786106","kompasiana"
"1209070370226987009","Mon Dec 23 12:10:38 +0000 2019","6","@Dandhy_Laksono @Merah_Johansyah Akhir2 ini memang lebih padat bang biasanya maksimal 3 tongkang bergantian tdk pernah sepadat itu. Ntah apakah mereka kejar target menghabiskan cadangan sebelum jd ikn atau apa yg jelas mencemaskan","1209083891706822658","","Dandhy_Laksono","in","","0","1","3","https://twitter.com/hnysof/status/1209083891706822658","1115958144159498240","hnysof"
"1209686192003792896","Wed Dec 25 04:03:57 +0000 2019","2","#KAMUHARUSTAU Kementerian PUPR akan segera mengundang ahli-ahli terkait lainnya dari tingkat nasional dan internasional untuk menilai kualitas Urban Design IKN yang lebih paripurna #ibukotabaru #PUPR #SayembaraIbuKota https://t.co/AGajiwOXOb","1209686192003792896","","","in","Jakarta","0","0","1","https://twitter.com/indozonemedia/status/1209686192003792896","350668803","indozonemedia"
"1209268719735590912","Tue Dec 24 00:25:04 +0000 2019","19","Konsep desain ini sanggup memukau dewan juri yang diketuai oleh Imam Santoso Ernawi yang sekaligus juga bertindak sebagai Ketua Satgas Perencanaan IKN https://t.co/zB8JQhQRCh","1209268719735590912","","","in","Jakarta","2","1","7","https://twitter.com/kompascom/status/1209268719735590912","23343960","kompascom"
"1208985870952325128","Mon Dec 23 05:41:08 +0000 2019","1","Baru lihat ada desain ikn yg nggak nge-grid landmark istana negara dll didesain konsep hutan dan lautan (negara kepulauan) nyambung sama judulnya selamat buat juara 1 ","1208985870952325128","","","in","Jakarta - Semarang | Indonesia","0","2","0","https://twitter.com/urekanz/status/1208985870952325128","132441549","urekanz"
"1210107156588048384","Thu Dec 26 08:00:46 +0000 2019","1","@Nimwesiga5 Ikn d truth ","1210108177460736001","","","in","Kampala ","0","0","0","https://twitter.com/samorabenard1/status/1210108177460736001","1064936663942598657","samorabenard1"
"1209003116156338176","Mon Dec 23 06:49:39 +0000 2019","0","Pengumuman! Pemerintah berencana membuka sayembara desain gedung-gedung pemerintahan di ibu kota negara (IKN) yang baru di Kalimantan Timur. #IbuKotaBaru https://t.co/mTrdP9WNkK","1209003116156338176","","","in","Jakarta, Indonesia","0","1","1","https://twitter.com/detikfinance/status/1209003116156338176","135795460","detikfinance"
"1210228321587347456","Thu Dec 26 16:21:14 +0000 2019","5","@Aryprasetyo85 lnjut pak........ operasi snyap aj trus smpai ikn nemo sgede paus....","1210234121521205248","","Aryprasetyo85","in","","0","0","0","https://twitter.com/Lutanojr/status/1210234121521205248","1160921783240814598","Lutanojr"
"1208978432735891456","Mon Dec 23 05:11:34 +0000 2019","5","Ada kesenjangan antara kuantitas dengan kualitas air di lokasi Ibu Kota Negara (IKN) baru di Kalimantan Timur. Lantas bagaimana penjelasannya? Ini adalah hasil kajian lapangan dan ilmiah. Turut memberikan perspektif pembangunan IKN @jokowi @BappenasRI","1208978432735891456","","","in","INDONESIA","0","0","0","https://twitter.com/yoesepbudianto/status/1208978432735891456","562876775","yoesepbudianto"
"1209033677390270464","Mon Dec 23 08:51:06 +0000 2019","1","Nagara Rimba Nusa Jadi Juara I Sayembara Desain Ibu Kota Baru Berikut Daftar Pemenang dan Desain #NagaraRimbaNusa #desainIKN #desainibukotabaru #ibukotabaru #IKN https://t.co/QjHQKi4p29 via @tribunkaltim","1209033677390270464","","","in","Balikpapan, Indonesia","0","0","0","https://twitter.com/tribunkaltim/status/1209033677390270464","103551225","tribunkaltim"
"1208963301926830080","Mon Dec 23 04:11:27 +0000 2019","0","Ya pasti sih. Nunggu 5-10 tahun dulu biar rimbun lagi. Semoga PNS yang bedol desa ke IKN nanti nggak kaget kalo ketemu piton biawak dan buaya~","1208963301926830080","","","in","Dapil Jabar VI : Bekasi-Depok","0","2","0","https://twitter.com/rizkidwika/status/1208963301926830080","41284868","rizkidwika"
"1209004144201261056","Mon Dec 23 06:53:44 +0000 2019","20","Pengumuman! Pemerintah berencana membuka sayembara desain gedung-gedung pemerintahan di ibu kota negara (IKN) yang baru di Kalimantan Timur. #IbuKotaBaru via @detikfinance https://t.co/RMKNX1DSqS","1209004144201261056","","","in","","1","2","7","https://twitter.com/detikcom/status/1209004144201261056","69183155","detikcom"
"1209450143482646528","Tue Dec 24 12:25:59 +0000 2019","1","Selamat kepada pemenang Sayembara Desain Ibu Kota Negara. Sangat senang kita akan membangun IKN dengan konsep #sustainability (keberlanjutan) memadukan unsur 3P yaitu #people (Komunitas) #planet (Alam) yang pada akhirnya membawa #prosperity (kesejahteraan).","1209450143482646528","","","in","DKI Jakarta, Indonesia","0","1","0","https://twitter.com/ValerinaDaniel/status/1209450143482646528","95601041","ValerinaDaniel"
"1209957855484231680","Thu Dec 26 02:08:47 +0000 2019","1","@Hilmi28 ahlan wa sahlan di IKN ustad hehehe","1210019597958541312","","Hilmi28","in","Balikpapan, Kalimantan Timur","0","0","0","https://twitter.com/hamizwar/status/1210019597958541312","1096581918873636864","hamizwar"
"1209106014789746689","Mon Dec 23 13:38:32 +0000 2019","10","Karya desain ini ditetapkan sebagai pemenang pertama sayembara gagasan desain kawasan IKN mengalahkan empat finalis lainnya. https://t.co/wBEcQ6MOsk","1209106014789746689","","","in","Jakarta","0","0","7","https://twitter.com/kompascom/status/1209106014789746689","23343960","kompascom"
"1209076200456376320","Mon Dec 23 11:40:04 +0000 2019","7","Salah satu juri sayembara IKN yang juga Gubernur Jawa Barat Ridwan Kamil mengatakan konsep desain tersebut dipilih Presiden karena punya kelebihan. https://t.co/48CmBrA73Y","1209076200456376320","","","in","Jakarta","1","0","3","https://twitter.com/kompascom/status/1209076200456376320","23343960","kompascom"
"1209389741633724416","Tue Dec 24 08:25:58 +0000 2019","3","Presiden Jokowi : 755 peserta 292 karya lima finalis. Begitu besar antusiasme desainer untuk ikut dalam sayembara desain ibu kota negara (IKN). Terpilih sebagai juara I adalah desain bertema Nagara Rimba Nusa oleh Urban+ disusul The Infinite City dan Kota Seribu Galur https://t.co/KV0Y8OBa2P","1209389741633724416","https://pbs.twimg.com/media/EMidjeZUwAAEZ9b.jpg","","in","Jakarta - INDONESIA","0","0","0","https://twitter.com/canzone/status/1209389741633724416","34235991","canzone"
"1209130289643040770","Mon Dec 23 15:15:00 +0000 2019","7","Menurut Ridwan desain IKN yang diusung Urban+ punya keberfungsian yang bisa dipertanggungjawabkan dengan pemanfaatan lahan yang efisien - #Regional https://t.co/zAQodBla8L","1209130289643040770","","","in","Jakarta","0","0","1","https://twitter.com/kompascom/status/1209130289643040770","23343960","kompascom"
"1208996679996841985","Mon Dec 23 06:24:05 +0000 2019","11","Menteri PUPR Basuki Hadimuljono menekankan bahwa ibu kota negara (IKN) di Kalimantan Timur harus punya konsep yang berbeda dengan negara lain. Seperti apa bentuknya? #IbukotaBaru via @detikfinance https://t.co/MsTO2qgWEb","1208996679996841985","","","in","","1","2","3","https://twitter.com/detikcom/status/1208996679996841985","69183155","detikcom"
"1208999635722932226","Mon Dec 23 06:35:49 +0000 2019","2","Menteri PUPR Basuki Hadimuljono menekankan bahwa ibu kota negara (IKN) di Kalimantan Timur harus punya konsep yang berbeda dengan negara lain. Seperti apa bentuknya? #IbukotaBaru https://t.co/y8jeHHTXhV","1208999635722932226","","","in","Jakarta, Indonesia","0","0","0","https://twitter.com/detikfinance/status/1208999635722932226","135795460","detikfinance"
"1209826863519948802","Wed Dec 25 13:51:18 +0000 2019","1","@QAMAL_IA Ye penh dgr arga 50k..masa g kedai ikn..sbb tu bkn mudah nk jaga ikn ni..mknn diee pun bkn boleh main tarok jer","1209834002930008065","","QAMALIA_","in","Selangor darul POWER!","0","1","0","https://twitter.com/Joker6014/status/1209834002930008065","1116832222382657537","Joker6014"
"1209251677561208832","Mon Dec 23 23:17:21 +0000 2019","0","Video Desain Pemenang Sayembara Ibu Kota Negara Begini Penampakan IKN ke Depannya https://t.co/gfbIkngQBW #IbuKotaNegara #IKN #Penajam #Sepaku #Kaltim #KalimantanTimur #IbuKotaBaru #Indonesia #desain #video #Sayembara #Arsitektur #Modern #NagaraRimbaNusa #Nusantara","1209251677561208832","","","in","Balikpapan, Indonesia","0","0","0","https://twitter.com/tribunkaltim/status/1209251677561208832","103551225","tribunkaltim"
"1211147239336349696","Sun Dec 29 04:58:34 +0000 2019","1","@suadgalow11 Wallahi midaas been aheen gacmo wada jir bee wax ku qabtaan 10 qof oo si sax ah hadaa is garab sano Aa maanta wadanka dhan badali garo wallahi calool xumo qof walbo wuu iska aamusanyahay midkii Ikn wax qaban rabo wuu cabsanaa yaa rabi","1211149489303642114","","suadgalow11","in","Somalia","0","0","0","https://twitter.com/FahmoHaji/status/1211149489303642114","1058034627976282119","FahmoHaji"
"1208977297581068288","Mon Dec 23 05:07:04 +0000 2019","3","Kementerian PUPR mengumumkan pemenang sayembara desain Ibu Kota Negara (IKN) baru. https://t.co/X35KwZgPoq","1208977297581068288","","","in","","2","0","4","https://twitter.com/kumparan/status/1208977297581068288","759692754985242625","kumparan"
"1210443981852561409","Fri Dec 27 06:15:08 +0000 2019","0","Manuntung Festival Art dan Bagenjoh 2 Jadi Agenda Tahunan di Balikpapan Persiapan Sambut IKN: Manuntung Festival Art dan Bagenjoh 2 Jadi Agenda Tahunan di Balikpapan Persiapkan Diri Sambut IKN https://t.co/4m9rk1XzVM","1210443981852561409","","","in","Kalimantan Timur, Indonesia","0","0","0","https://twitter.com/KaltimBerita/status/1210443981852561409","1536217758","KaltimBerita"
"1209037059718991872","Mon Dec 23 09:04:32 +0000 2019","0","Pemenang Desain IKN Sudah Ada Ini Rencana Aksi Selanjutnya https://t.co/WHCoc1HBwx","1209037059718991872","","","in","Jakarta, Indonesia","0","0","0","https://twitter.com/Bisniscom/status/1209037059718991872","118646322","Bisniscom"
"1208986426479665153","Mon Dec 23 05:43:20 +0000 2019","0","Juri sayembara desain IKN memutuskan Nagara Rimba Nusa sebagai pemenang sayembara. Desain itu dinilai memenuhi kriteria yang telah ditetapkan. https://t.co/OePMjzKqz4","1208986426479665153","","","in","Jakarta, Indonesia","0","0","0","https://twitter.com/inewsdotid/status/1208986426479665153","944180887171743745","inewsdotid"
"1209036635721129984","Mon Dec 23 09:02:51 +0000 2019","0","Menteri PUPR Basuki Hadimuljono meminta kepada ketiga pemenang gagasan desain Ibu Kota Negara (IKN) untuk saling bersinergi. https://t.co/d6PCYl33c1","1209036635721129984","","","in","Jakarta, Indonesia","0","0","0","https://twitter.com/inewsdotid/status/1209036635721129984","944180887171743745","inewsdotid"
"1208631891382784001","Sun Dec 22 06:14:32 +0000 2019","6","Pengumuman pemenang sayembara gagasan desain IKN yang digelar Kementerian Pekerjaan Umum dan Perumahan Rakyat (PUPR) tersebut dilakukan Senin besok. https://t.co/96FgbCzbdg","1208631891382784001","","","in","Jakarta","1","0","1","https://twitter.com/kompascom/status/1208631891382784001","23343960","kompascom"
"1209153822762778624","Mon Dec 23 16:48:36 +0000 2019","0","@B3nn4y Hi please find the unroll here: Thread by @jatamnas: UJI KLAIM PEMERINTAH. Di balik pemindahan ibu kota negara (IKN) sesungguhnya terdapat setumpuk https://t.co/yFiQVZNYOo. Share this if you think it's interesting. ","1209153846729154560","","B3nn4y","in","Wherever threads are written..","0","0","0","https://twitter.com/threadreaderapp/status/1209153846729154560","895814938995957760","threadreaderapp"
"1211580836400812032","Mon Dec 30 09:32:36 +0000 2019","1","Warga suku Dayak Paser di kawasan IKN sekitar 70 ribu orang https://t.co/Wmn7XjDfb4","1211580836400812032","","","in","","0","0","0","https://twitter.com/IDNTimes/status/1211580836400812032","388190238","IDNTimes"
